title,content,link_to_resource,published_date
Burundi: Kọ Ìkọkúkọ sórí àwòrán Ààrẹ —  kí o wẹ̀wọ̀n,"Ààrẹ Jacob Zuma bẹ Burundi wo ní 25, oṣù Èrèlé ọdún 2016. Orísun àwòrán: ìjọba ZA. Flickr, àṣẹ CC.
Akẹ́kọ̀ọ́ mẹ́fà di ẹni àtìmọ́lé lọjọ́ Ìṣẹ́gun 12, oṣù Ẹrẹ́nà ní agbègbè Kirundo ní Àríwá Ìlà-oòrùn Burundi fún ẹ̀sùn-un kíkọ ìkọkúkọ sórí àwòrán Ààrẹ Pierre Nkurunziza nínú àwọn ìwé ìkọ́ni márùn-ún. Wọ́n fi ẹ̀sùn “títa àbùkù bá Ààrẹ orílẹ̀-èdè” kàn àwọn akẹ́kọ̀ọ́ náà.
Ẹgbẹ́ Àwọn Àjọ tí ó ń ṣe Àmójútó ìwàlálàáfíà Àwọn ọmọdé ní Burundi (FENADEB) jábọ̀ pé wọ́n ti fi akẹ́kọ̀ọ́ kan tí ó jẹ́ ọmọ ọdún mẹ́tàlá sílẹ̀ lẹ́sẹkẹsẹ̀ nítorí pé ó ṣì kéré, kò sì tí ì tó ọdún mẹ́ẹ̀dógún.
Wọ́n jábọ̀ pé wọ́n ṣe ìdásílẹ̀ àwọn akẹ́kọ̀ọ́ mẹ́ta lọ́jọ́ Ẹtì, 15 oṣù Ẹrẹ́nà ṣùgbọ́n àwọn mẹ́ta yòókù ṣì wà ní àtìmọ́lé. Àwọn ọmọ náà tí wọn kò ju ọmọ ọdún 15 sí 17 yóò ṣe ẹ̀wọ̀n ọdún márùn-ún bí wọ́n bá jẹ̀bi ẹ̀sùn ìtàbùkù bá Ààrẹ orílẹ̀-èdè. Ìwé ìròyìn iwacu jábọ̀ pé àwọn ìdílé tí ọ̀rọ̀ náà kàn wà nínú ìdààmú gidi.
“Ìkọkúkọ [lórí àwòrán Ààrẹ] jẹ́ ẹ̀ṣẹ̀ tí ó mú ìjìyà dání lábẹ́ òfin ilẹ̀ Burundi gẹ́gẹ́ bí àbọ̀ ìwádìí Reuters kan ṣe sọ. Bí ó tilẹ̀ jẹ́ pé ọjọ́-orí àwọn ọ̀daràn náà lè jẹ́ ìdí fún ṣíṣe àdínkù ìjìyà ẹ̀sẹ̀ nínú ìgbẹ́jọ́ àwọn akẹ́kọ̀ọ́ yìí.
Gẹ́gẹ́ bí olùkọ́ kan tí kò dárúkọ araa rẹ̀ ṣe sọ, wọn kò yẹ àwọn ìwé ìkọ́ni wọ̀nyí wò fún àìmọye ọdún, àwọn akẹ́kọ̀ọ́ sì máa ń pín in lò ni, fún ìdí èyí ó nira láti mọ ẹni tí ó kọ nǹkan sí i ní pàtó.
Ìṣẹ̀lẹ̀ tó fara jọ èyí ṣẹlẹ̀ ní 2016, lẹ́yìnin rògbòdìyàn sáà kẹ́ta Ààrẹ náà, nígbà tí àwọn akẹ́kọ̀ọ́ nílé ẹ̀kọ́ kọ ìkọkúkọ sórí àwòrán (Ààrẹ) Nkurunziza nínú ìwé ìkọ́ni. Àwọn aláṣẹ rí èyí gẹ́gẹ́ bí ìwọ̀sí gidi tí wọ́n sì lé ọgọọgọ̀rún akẹ́kọ̀ọ́ kúrò ní àwọn ilé ẹ̀kọ́ lóríṣìíríṣi káàkiri orílẹ̀-èdè náà. Akẹ́kọ̀ọ́ mọ́kànlá ni wọ́n fẹ̀sùn ìtàbùkù bá adarí ìlú àti “ìhàlẹ̀ mọ́ ààbò ìlú” kàn, bí ó tilẹ̀ jẹ́ pé wọ́n padà dá wọn sílẹ̀.
Wọ́n bu ẹnu àtẹ́ lu ìwà yìí gidigidi. Zeid Ra'ad Al Hussein, tí ó jẹ́ aṣàkóso fún ẹ̀ka ìjàfẹ́tọ̀ọ́ ènìyàn lábẹ́ United Nations gbé àkọsílẹ̀ kan jáde ní 29, oṣù Òkúdù 2016:
Ẹ̀rù ń bà mí pẹ̀lú àwọn ìròyìn tí mò ń gbọ́ nípa lílé tí wọ́n ń lé àwọn ọmọ ní ilé-ẹ̀kọ́ àti bí wọ́n ṣe ń tì wọ́n mọ́lé nítorí ìkọkúkọ tí wọ́n kọ sórí àwòrán Ààrẹ nínú àwọn ìwé ìkọ́ni.
Nkurunziza,’ Adarí ayérayé tó ga jù’
Ààrẹ Pierre Nkurunziza ti Burundi. Àwòrán láti ọ̀dọ̀ Eric Miller / Àjọ ọrọ̀-ajé àgbáyé, ìpéjọ Adúláwọ̀ ní 2008, Cape Town, 3 sí 6, oṣù Òkúdù 2008. Àwòrán lọ́dọ̀ Flicker (CC NÍPA-NC-SA 2.0).
Pierre Nkurunziza ti jẹ ààrẹ ilẹ̀ Burundi láti ọdún 2005. Ní ọdún 2015, àwọn ẹgbẹ́ òṣèlúu rẹ̀ tún gbé e sípò fún sáà kẹ́ta lórí oyè.
Ní oṣù Ẹrẹ́nà ọdún tó kọjá, Nkurunziza gba orúkọ tuntun lọ́dọ̀ àwọn ẹgbẹ́ òṣèlúu rẹ̀, Àjọ Agbèjà Òmìnira Àwọn Ológun – Fún Ìgbéga Ìjọba Oníbò (CNDD-FDD). Wọ́n pè é ní “adarí ayérayé tó ga jù”.
Akọ̀wé gbogboògbò fún CNDD-FDD, Evariste Ndayishimiye ṣàlàyé ìdí tí orúkọ náà ṣe di ti Nkurunziza:
Olùdaríi wa ni, kò sí eni tí a lè fi wé e nínú ẹgbẹ́ẹ wa. Òun ni òbíi wa, òun ni ó ń gbà wá nímọ̀ràn. Ìdí nìyí tí mo ṣe ní kí gbogbo ọmọ ẹgbẹ́ pọ́n ọn lé nítorí pé ojúkójú ni ẹnikẹ́ni lè fi wo ilé tí kò ní olórí. Ní tiwa, olórí tó dára jù ni a ní.
Bí àwọn CNN-FDD ṣe gbé oyè náà ní yẹpẹrẹ tó ipò agbára Nkurunziza gẹ́gẹ́ bí adarí ayérayé tó ga jù ti jẹ́ kí ó nira fún ẹnikẹ́ni láti kọ ohunkóhun tí ó bá yàn láti ṣe, títí mọ́ ìgbésẹ̀ rẹ̀ láti ṣe àyípadà òfin sáà méjì fún ipò adarí tí ó wà nínú ìwé òfin orílẹ̀-èdè náà. Èyí ń ṣe àfihàn àdálò tí ẹgbẹ́ òṣèlú tó wà lórí oyè ń dá agbára lò pẹ̀lú Nkurunziza àti àwọn alátìlẹyìn-in rẹ̀ pẹ̀lú bí ẹgbẹ́ òṣèlú náà ṣe ń darí àwọn ìdásílẹ̀ ìjọba.
Àwọn oníkọkúkọ ní ìṣọ̀kan
Àwọn ọmọ ìlú tí wọ́n ń ṣàmúlò ayélujára ti bẹ̀rẹ̀ ìkọkúkọ sórí àwòrán ààrẹ Nkurunziza nínú ìfẹ̀hónúhàn pẹ̀lú àmì ìdámọ̀: #Nkurunziza àti #Burundi:

Burundians online are scribbling in protest, doodling on pictures of President Nkurunziza in reaction to the arrest of three school girls who were detained for drawing over the picture of the President on their school books.
— Patience Atuhaire (@patuhaire) March 22, 2019

Àwọn ọmọ Burundi tí ń kọ ìkọkúkọ sí orí àwòrán Ààrẹ Nkurunziza nínú ìfẹ̀hónúhàn orí ayélujára látàrí àtìmọ́lé akẹ́kọ̀ọ́bìnrin mẹ́ta nítorí pé wọ́n ya nǹkan sí orí àwòrán Ààrẹ tí ó wà lórí ìwé ìkọ́ni wọn.


#Burundi : des lycéennes en prison pour le gribouillage d’un portrait du prédident #Nkurunziza @LewisMudge @hrw @hrw_fr https://t.co/BkAP5PfglK pic.twitter.com/z4HkiFbi3Z
— Eléonore Abou Ez (@Eleoabouez) March 22, 2019
Ọmọ ilé ẹ̀kọ́ gíga ní ẹ̀wọ̀n fún kíkọ ìkọkúkọ sí orí àwòrán Ààrẹ #Nkurunziza.

If I did this in #Nkurunziza’s #Burundi, I could be jailed #GribouilleMoi https://t.co/V7nVxKXZ0P pic.twitter.com/ahcO0apSQ7
— Wietske Nijman (@WietskeNijman) March 21, 2019

Bí mo bá ṣe èyí ní Burundi #Nkurunziza #Burundi, ó ṣe é ṣe kí a fi mí sí àtìmọ́lé #GribouilleMoi https://t.co/V7nVxKXZ0P pic.twitter.com/ahcO0apSQ7


#Burundi Thank you @CNN @jeune_afrique @FRANCE24 @RFIAfrique @africanews @lemondefr & others for your solidarity with jailed teenage girls bcz they scribbled @pnkurunziza 's picture. 
The Burundian autocratic regime must know that prison doesn't educate. @radio_rpa @RadioInzamba pic.twitter.com/3R9KQ1oz6Y
— NDAYISHEMEZA Denis (@NDAYISHEMEZAD) March 22, 2019

#Burundi o ṣeun @CNN @jeune_afrique @FRANCE24 @RFIAfrique @africanews @lemondefr àti àwọn tí ó kù fún ìdúróṣinṣin fún àwọn ọ̀gọ̀dọ̀bìnrin tí a fi sí àtìmọ́lé nítorí wípé wọ́n kọ nǹkan sí orí àwòrán @pnkurunziza. 
Ìṣàkóso ìfipáṣèjọba Burundi  ní láti mọ̀ wípé túbú kì í kọ́ ni lẹ́kọ̀ọ́. @radio_rpa @RadioInzamba pic.twitter.com/3R9KQ1oz6Y

The government of #Burundi jailed schoolgirls for allegedly scribbling on photos of the president. We tweeted our scribbled photos in solidarity. 
They dared us to scribble on our president's photo, so I did. I am confident I will not be arrested here.  https://t.co/eqrrxussun
— Andrew Stroehlein (@astroehlein) March 22, 2019

Ìjọba #Burundi fi akẹ́kọ̀ọ́bìnrin sí àtìmọ́lé látàrí ẹ̀sùn ìkọkúkọ sí orí àwòrán ààrẹ. A túwíìtì àwòrán ìkọkúkọ wa ní ìbánikẹ́dùn ìṣẹ̀lẹ̀ náà.
Wọ́n ní kí a dán an wò, kí a kọ nǹkan sí orí àwòrán ààrẹ  mo sì ṣe bẹ́ẹ̀. Mo ní ìgbóyà wípé ẹnikẹ́ni kò ní mú mi níbí. https://t.co/eqrrxussun
Ìfòfinlíle mú àtakò

Ìjọba Burundi ti bẹ̀rẹ̀ sí í fi ìkanra mú ìwà àtakò láti ọdún 2015, lẹ́yìn ìjákulẹ̀ ìṣọ̀tẹ̀ kan, ìdojúkọ pẹ̀lú àwọn ẹgbẹ́ adìtẹ̀ kan, àtakò lórí ìlòkulò ẹ̀tọ́, òfin kànńpá, ìnira pẹ̀lú ètò ọrọ̀-ajé àti rògbòdìyàn àwọn asásàálà. European Union pẹ̀lú United Nations tako ìgbésẹ̀ Nkurunziza fún sáà kẹ́ta, wọ́n sì béèrè fún ìdápadà ìlọdéédé kí àsìkò ìdìbò ó tó dé. Pẹ̀lú àwọn ìdojúkọ wọ̀nyí, “ipò náà” le sí i. Àwọn aláṣẹ sì ń fi ìkanra mú gbogbo ìhàlẹ̀ tí wọ́n ń rí.
Ìjábọ̀ pàtàkì ti àjọ ajàfẹ́tọ̀ọ́ ènìyàn ṣe ní oṣù Èbìbí 2018 rí i pé àwọn èṣọ́ aláàbò ní Burundi, àwọn afòyeṣiṣẹ́ àti àwọn ọmọ ẹgbẹ́ òṣèlú tí ó wà nípò, àwọn ẹgbẹ́ Imbone… ń kọlu àwọn alátakò àti àwọn ẹni tí wọ́n fura sí gẹ́gẹ́ bí alátakò pẹ̀lú ajàfẹ́tọ̀ọ́ ènìyàn àti akọ̀ròyìn. “Wọ́n pa èèyàn tó tó 1700, bẹ́ẹ̀ ni wọ́n sì ń fi ipá lé àwọn ẹlòmíìn, wọ́n ń fi ipá bá wọn ní ìbálòpọ̀, wọ́n ń fi ìyà jẹ wọ́n, wọ́n ń tì wọ́n mọ́lé, bẹ́ẹ̀ ni wọ́n sì ń dẹ́rùba àìmọye àwọn mìíràn”.
Èyí ti dá wàhálà ìsásàálà sílẹ̀, a ti rí àwọn ará Burundi tí wọ́n sá lọ sí Tanzania, Rwanda, Congo àti Uganda. Bí ó tilẹ̀ jẹ́ pé ẹgbẹẹgbẹ̀rún ti padà sílé. Alákòóso United Nations fún ìsásàálà ti ṣe àkọsílẹ̀ àwọn asásàálà tí ó wá láti Burundi tí wọ́n lé ní 347,000 ní oṣù Èrèlé 2019, UNHCR fìdí ẹ̀ múlẹ̀:
…Làásìgbò nínú òṣèlú Burundi le sí i ní ọdún 2015 lẹ́yìn tí ààrẹ́ kéde èròńgbàa rẹ̀ láti lọ fún sáà kẹ́ta. Ìfẹ̀hónúhàn àwọn èèyàn láti tako èròńgbà fa ìkọlura, ọgọọgọ̀rún àwọn èèyàn sì sá lọ sí àwọn orílẹ̀-èdè ìtòsí láti fi oríi wọn pamọ.”
Ní ìbẹ̀rẹ̀ oṣù yìí, ìjọba Burundi ti ọ́fíìsì ẹ̀ka àwọn ajàfẹ́tọ̀ọ́ ènìyàn lábẹ́ United Nations tí wọ́n sì sọ pé àwọn kò nílòo wọn mọ́. Ìjọba náà ń bínú sí alákòóso tẹ́lẹ̀-rí ẹ̀ka náà, Zeid Ra'ad Al Hussein tí ó ṣàpèjúwe Nkurunziza ti Burundi gẹ́gẹ́ bí ọkàn lára “àwọn apanilẹ́kúnjayé ènìyàn tí ó ń gbèrú sí i láìpẹ́ yìí” ní oṣù Èrèlé 2018.
Àtipa àwọn Ilé-iṣẹ́ Akọ̀ròyìn, ìyọlẹ́nu àwọn alátakò, ìfòfinlíle mú àwọn ìdásílẹ̀ tí kì í ṣe ti ìjọba (NGOs) àti ìdiwọ́ fún àwọn mìíràn láti sọ̀rọ̀ tàbí ṣe àfihàn ara wọn ní ààyè òṣèlú.
Fún àpẹẹrẹ, wọ́n dájọ́ ẹ̀wọ̀n ọdún méjìlélọ́gbọ̀n fún ajàfẹ́tọ̀ọ́ ènìyàn Germain Rukiki fún “ìdarapọ̀ mọ́ ìgbìyànjú ìrúlùú, “jíjin ètò ààbò ìlú lẹ́sẹ̀, àti ìṣọ̀tẹ̀” ní 2018 nítorí pé ó ṣe àkọsílẹ̀ àwọn ọ̀nà tí ìjọba Nkurunziza ń gbà fìyà jẹni. Àwọn àìṣedede kan dá ìgbẹ́jọ́ Rukiki dúró, ó sì wáyé ní ọ̀sẹ̀ mélòó kan ṣáájú àríyànjiyàn ìdìbò abófinmu náà.
“Ọ̀rọ̀ ìkọkúkọ” náà ń ṣe àfihàn ìdúróṣánṣán ìjọba náà tí kò yẹ̀ àti ọ̀nà tí wọ́n ń gbà ṣe ẹ̀tọ́ọ wọn, títí mọ́ ṣíṣe ìgbéyàwó kànńpá fún àwọn tọkọtaya tí wọ́n ń gbépọ̀ láìṣe ìgbéyàwó ní 2017: ìfòfinlíle mú òwòo panṣágà àti agbe ṣíṣe.",https://yo.globalvoices.org/2019/04/20/333/,20 Igbe  2019
Oníròyìn Orí ẹ̀rọ-alátagbà Luis Carlos Diaz di àwátì ní Venezuela,"“Níbo ni Luis Carlos wà?” Àwòrán ìpolongo orí ayélujára tí Provea taari síta. Wọ́n sọ ìgbà tí a pè é kẹ́yìn àti túwíìtì tí ó tẹ̀ kẹ́yìn nínú àwòrán náà.
Ní ìrọ̀lẹ́ ọjọ́ 11, oṣù Ẹrẹ́nà olùfèsì sí ọ̀rọ̀ ìṣèlú Naky Soto tí ó tún jẹ́ aya akọ̀ròyìn àti ajììjàǹgbara iṣẹ́ ìròyìn tí ó jẹ́ ọmọ orílẹ̀ Venezuela, Luis Carlos Díaz túwíìtì pé òun ti ń wá ọkọ òun fún wákàtí márùn-ún.
[Ìròyìn tí ó tẹ̀ wá lọ́wọ́] Àjọ àwọn Òṣìṣẹ́ Ìròyìn (SNTP lédè Spanish) jábọ̀ pé àwọn Agbófinró Ọ̀tẹlẹ̀múyẹ́ Bolivaria (SEBIN) ti fi Luis Carlos sí àtìmọ́lé.

#URGENTE | Comision del Sebin confirma que el periodista Luis Carlos Diaz está detenido en ese organismo policial apuntan con armas a directivos a @mruizsilvera, @LuzMelyReyes, @LilaVanorio y a @FedericoBlackB #DondeEstaLuisCarlos #12Mar
— SNTP (@sntpvenezuela) March 12, 2019
PÀJÁWÌRÌ Àjọ Sebin kan fìdíi rẹ̀ múlẹ̀ pé akọ̀ròyìn Luis Carlos Diaz ti wà ní àhámọ́ àwọn ọlọ́pàá yẹn. Wọ́n yọ àwọn ohun ìjà ti akọ̀ròyìn Marco Ruiz, Luz Mely Rehes àti Federico Black [pẹ̀lú àwọn ọmọ ẹgbẹ́ òṣìṣẹ́ ìròyìn.
Wákàtí díẹ̀ sẹ́yìn, Soto túwíìtì pé àwọn ti ń wá Luis Carlos Díaz fún wákàtí márùn-ún:

Estimados: perdí contacto con @LuisCarlos a las 5:30 de la tarde, cuando me dijo que venía a casa a descansar porque esta noche haría una jornada especial en @Unionradionet desde las 10:00 pm hasta las 5:00 am#DóndeEstáLuisCarlos
— Naky Soto (@Naky) 12 de marzo de 2019
Ẹ̀yin èèyàn àtàtà: Mi ò rí @LuisCarlos bá sọ̀rọ̀ láti aago 5:30 lọ́sàn-án yìí, ó sì sọ fún mi pé òun ń bọ̀ nílé láti sinmi nítorí pé òun ní ìkéde pàtàkì kan láti se lórí @Unionradionet láti aago 10:00 alẹ́ sí 5:00 ìdájí #DóndeEstáLuisCarlos

.@LuisCarlos anda en bicicleta, pero desde las 5:30 pm no sé nada sobre él y:
– no está en la emisora
– no está en casa
– no ha tuiteado
– no contesta llamadas
– no contesta SMS ni mensajes en WhatsApp#DóndeEstáLuisCarlos
— Naky Soto (@Naky) 12 de marzo de 2019
@LuisCarlos wà ní orí kẹ̀kẹ́ẹ rẹ̀, ṣùgbọ́n láti aago 5:30 ni mi kò ti gbúròó rẹ̀ mọ́, bẹ́ẹ̀:
– Kò sí ní ilé iṣẹ́ ìgbóhùnsáfẹ́fẹ́ náà
– Kò sí nílé
– Kò tíì túwíìtì
– Kò gbé ìpèe rẹ̀
– Kò fèsì sí àtẹ̀jíṣẹ́ tàbí iṣẹ́-ìjẹ́ oríi WhatsApp
#DóndeEstáLuisCarlos
[Ìròyìn tó tẹ̀wá lọ́wọ́] Luz Mely Reyes tí ìṣẹ̀lẹ̀ náà ṣe ojúu rẹ̀, fi tó wa létí nípa bí àwọn Agbófinró SEBIN ṣe yẹ ilée Díaz pẹ̀lú ilée Soto náà wò. Ìsọ̀kan àwọn Oníròyìn náà fẹ ọ̀rọ̀ náà lójú:

#URGENTE | A esta hora, 2:30 am, comisión del Sebin llega a la residencia del periodista y activista de Ddhh, Luis Carlos Díaz, desaparecido desde las 5:30 pm #DondEstaLuisCarlos #12Mar
— SNTP (@sntpvenezuela) March 12, 2019
NÍ KÍÁKÍÁ Ní dédé àsìkò yìí, ní dédé agogo 3:00 òwúrọ̀ kùtùkùtù, ìgbìmọ̀  láti àjọ Amúninípá dé ilé oníròyìn àti ajà-fún- ẹ̀tọ́ọ ọmọ ènìyàn Luis Carlos Díaz, tí ó ti di ẹni àwátì láti agogo 5:30 ìrọ̀lẹ́ #NiboNiLuisCarlosWa.
Àwọn ajàfúnẹ̀tọ́ ọmọnìyàn àti àjọ òmìnira ọ̀rọ̀ sísọ náà darapọ̀ mọ ìpolongo yìí pẹ̀lú #DondeEstaLuisCarlos (Níbo ni Luis Carlos wà?), tí ó jẹ́ pé, ní báyìí, ni àkọlé tí ó gbajúmọ̀  ní orí ìkànnì ayélujára Twitter ti Orílẹ̀ Èdè Venezuela.
Díaz jẹ́ ajábọ̀ ìròyìn àti a-jà-fún-ẹ̀tọ́-ọmọ ènìyàn tí ó jẹ́ ògbólógbòó ajàfúnẹ̀tọ́ òmìnira ọ̀rọ̀ sísọ tí wọ́n sì mọ ìṣe rẹ̀ fún un l'órílẹ̀ èdè Venezuela àti òkè òkun fún ìdásọ́rọ̀ àti ìtakò ìjọba Nicholas Maduro. Ó ti tó ìgbà díẹ̀ kan tí ó ti ń ṣiṣẹ́ pẹ̀lú ìyàwó rẹ̀ àti olùdásọ́rọ̀ òṣèlú tí ó gbajúmọ̀ n nì, Naky Soto, tí wọn sì ń ṣe ìgbéjáde àwọn fídíò àti ètò Ìgbóhùnsáfẹ́fẹ́ lórí ayélujára èyí tí ó dá lórí ìṣèlú àti ẹ̀tọ́ ọmọ ènìyàn ní Venezuela. Ó ti ṣiṣẹ́ gẹ́gẹ́ bí akọ́ni àti olùgbé-lárúgẹ ìdásílẹ̀ àyè ọ̀tọ̀ fún àwọn ará ìlú àti àwọn àkànṣe eto ìgbóhùn sáfẹ́fẹ́ tí kò lọ́wọ́ ìjọ̀ba nínú. Díaz tún jẹ́ olùkópa nínú ẹgbẹ́ Ohùn Àgbáyé fún ọdún mẹ́wàá.

Para mí Luis Carlos es una pequeña lumbrera de información y redes en esta Venezuela tan caótica que nos tocó. Él ha logrado establecer vínculos con la sociedad (desde la crítica hasta espacios culturales) #DóndeEstáLuisCarlos
— Verónica A. Ifigenia (@verocosmica) March 12, 2019
Lọ́dọ̀ tèmi, Luis Carlos jẹ́ onílàákàyè ẹ̀dá kan, ó gbọ́njú nínú ìròyìn gbígbà àti ìkànsì-ara-ẹni nínú Venezuela ti wa yìí tí kò fara rọ. Ó ti ṣe àwárí ìjápọ̀ nínú ìlú (láti ìtakò sí ibi ìṣẹ̀ṣe) #NiboniLuisCarlosWa.
Láàrin ọjọ́ péréte tó ṣíwájú ìpòóráa rẹ̀, ètò ìkàn-sára- ẹni ti ìjọba Con el Mazo Dando ṣàfihàn fídíò tí Díaz sọ̀rọ̀ nínúu rẹ̀. Atọ́kùn ètò ọ̀hún, olóṣèlú Diosdado Cabello, rò kàn pé Díaz lọ́wọ́ sí ìfẹ̀hónú hàn àìsí ináa mọ̀nàmọ̀nà tí ò lọ jákèjádò orílẹ̀ èdè èyí tí ó mú kí àwọn ọmọ Venezuela máa gbé nínú òkùnkùn fún ó lé ní wákàtí mẹ́rin lé lógún lọ́jọ́ 7 àti 8 Oṣù Ẹrẹ́nà
Kò sí ẹ̀rí tí ó fi ẹsẹ̀ rinlẹ̀.

#DenunciaEP | Desde las 5:30 pm se desconoce el paradero del periodista Luis Carlos Díaz (@LuisCarlos). Hace varios días fue acusado de “influencer fascistoide” a través de la cuenta de Twitter de “Con el mazo dando”. #10Mar#DóndeEstáLuisCarlos
— Espacio Público (@espaciopublico) 12 de marzo de 2019
#DenounceEP Láti 5:30 ìrọ̀lẹ́ ni a kò ti mọ ibi tí oníṣẹ́ ìròyìn Luis Carlos Díaz wà. A fi ẹ̀sùn “ìlọ́wọ́sí- ìgbé ayé ìfipamúni” ní oríi ìṣàmúlò Twitter ti “Con el mazo dando”.

Ọ̀rẹ́ẹ wa @LuisCarlos jẹ́ ọ̀kan lára àwọn tí ó síwájú nínú akọ̀ròyìn tako ìgbésẹ̀ ìjọba ní Venezuela. Ọjọ́ díẹ̀ sẹ́yìn, ìpolongo Diosdado #conelmazodando ta bá  LC gẹ́gẹ́ bíi “èrò ìjọba US” lati mú kí orílẹ̀ èdè ó wà nínú òkùnkùn. #DóndeEstáLuisCarlos
— Caracas Chronicles (@CaracasChron) Ọjọ́ 12, oṣù Ẹrẹ́nà ọdún-un 2019
Bí ọjọ́ ṣe ń lọ láì rí ẹ̀rí tí ó yanrantí dì mú, SNTP darapọ̀ tí ó bẹ̀rẹ̀ àbẹ̀wò sí olú ilé iṣẹ́ẹ Ọ̀tẹlẹ̀múyẹ́ (SEBIN):

#AHORA | Siete horas han pasado desde que desapareció Luis Carlos Diaz, periodista de Unión Radio Noticias y activista de Ddhh. Estamos ahora en el Sebin del Helicoide y niegan tenerlo #DondeEstáLuisCarlos #12Mar
— SNTP (@sntpvenezuela) March 12, 2019
Wákàtí méje ti ré kọjá lọ tí Luis Carlos Díaz ti di àwátì. [Díaz] jẹ́ oníròyìn fún ilé iṣẹ́ ìgbóhùnsáfẹ́fẹ́ Unión Radio Noticias , ó sì tún jẹ́ ajàfúnẹ̀tọ́ ọmọnìyàn.
Àwa ní olú ilé iṣẹ́ẹ SEBIN headquarters àti pé wọ́n ní àwọn kò ní í [ní àhámọ́ àwọn] #NiboNiLuisCarlosWa.
[Ìròyìn tí ó tẹ̀ wá lọ́wọ́: they wọ́n pàpà jẹ́wọ́ wípé [Diaz wà ní akolóo wọn]
Akọ̀ròyìn Vladimir Villegas sọ wípé kò rí bẹ́ẹ̀ mọ́ wípé ìjọba ni ó fi ọwọ́ agbára mú u:

Se nos informa que el periodista Luis Carlos Diaz, de @Unionradionet, ha sido detenido por cuerpos de seguridad del Estado. Expresamos nuestra preocupación por su integridad física . Exigimos información cierta sobre su paradero y respeto a sus derecho humanos.
— Vladimir Villegas (@Vladi_VillegasP) March 12, 2019
Olóbó ti ta wá wípé oníròyìn fún @Unionradionet Luis Carlos Díaz, ti wà nínú àtìmọ́lé agbófinró Ìlú. A bá a kẹ́dùn ipò tí ó wà. A béèrè fún ìtọ́sọ́nà nípa mímọ ibi tí ó wà, àti ìbọ̀wọ̀ fún ẹ̀tọ́ ọmọnìyàn-an rẹ̀.
Ẹgbẹ́ Ohùn Àgbáyé dúró ṣinṣin pẹ̀lú Luis Carlos, ẹbíi rẹ̀, àti oníròyìn aládàáṣiṣẹ́ gbogbo  àwọn tí ó ń mú ìjọba ṣe bí ó ti yẹ ní Venezuela. À ń retíi rẹ̀ kí ó dé kíákíá ní àlàáfíà ara àti ẹ̀mí, a ó máa gbé àwọn ìròyìn síta nípa ìròyìn yìí bí ó ba ṣe ń tẹ̀ wá lọ́wọ́.",https://yo.globalvoices.org/2019/03/13/303/,13 Ẹrẹ́nà  2019
Ilé-iṣẹ́ Agbóhùnsáfẹ́fẹ́ Ìbílẹ̀ Fagilé Ìfọ̀rọ̀wọ́rọ̀ pẹ̀lú àwọn ajìjàǹgbara LGBT lẹ́yìn ìhalẹ̀mọ́ sí olóòtú,"Àwọn ajìjàǹgbara ní Madrid fi ẹ̀hónú hàn lórí ìrúfin ẹ̀tọ́ LGBT ní Russia // gaelx, lábẹ́ CC NÍPA-SA 2.0
Ilé-iṣẹ́ Echo ti Moscow ní Yaroslavl tí ó jẹ́ ẹ̀ka ilé-iṣẹ́ Agbóhùnsáfẹ́fẹ́ Echo ti Moscow ìsopọ̀ tí ó ti dá dúró fún ìgbà pípẹ́ ní Russia fagi lé ìfọ̀rọ̀wọ́rọ̀ pẹ̀lú àwọn ajìjàǹgbara LGBT lẹ́yìn tí wọ́n gba ìhalẹ̀ láti ọ̀dọ̀ àwọn tí ó kórìíra-ìbálòpọ̀-láàárín-akọ-àti-akọ, olóòtú ilé-iṣẹ́ náà Lyudmila Shabuyeva sọ̀rọ̀ nínú àkọsílẹ̀ Facebook kan:
Вчера поступили угрозы в адрес наших сегодняшних гостей и нас, если мы проведем эфир на тему ЛГБТ.
Я отменяю эфир.
Ní àná, a gba ìhàlẹ̀ kan tí ó ń lérí mọ́ àwa àti àwọn àlejòo wa tí a bá tẹ̀síwajú pẹ̀lú ètò ìfọ̀rọ̀wọ́rọ̀ọ wa nípa LGBT.
Mò ń fagi lé ètò náà.
Gẹ́gẹ́ bí ìwé ìròyìn tí ò sí ní abẹ́ ìṣàkóso ìjọba  Novaya Gazeta ti ṣe sọ, ó yẹ kí ètò náà tí yóò ṣe àfihàn àwọn ajìjàǹgbara LGBT ní Yaroslavl wáyé ní òwúrọ̀ Ọjọ́rú 23, ní oṣù Ṣẹẹrẹ. Àwọn ajìjàǹgbara yìí kan náà ṣẹ̀ṣẹ̀ fi ẹ̀hónú hàn ní gbàgede ìlú láti tako ìfìyàjẹ àwọn aṣe-ìbálòpọ̀-akọ-àti-akọ ní Russia, pàápàá jùlọ ní orílẹ̀ Chechnya. Ilé-iṣẹ́ agbóhùnsáfẹ́fẹ́ náà pè wọ́n láti fi ọ̀rọ̀ wá wọn lẹ́nu wò nípa ìfẹ̀hónúhàn àti ìrírí wọn fún jíjáde sí gbangba gẹ́gẹ́ bíi aṣe-ìbálòpọ̀-akọ-àti-akọ ní ẹ̀ka-ìlúu Russia.
Ìkéde Shebuyeva àkọ́kọ́ nípa ètò náà fa ẹgbẹlẹmùkù èébú ìkórìíra-ìbálòpọ̀-láàárín-akọ́-àti-akọ nínú àwọn èsì, tí èsì sì wá láti ọ̀dọ̀ àwọn òṣìṣẹ́ ọba kan bákan náà, ṣùgbọ́n ìyẹn ò mú ọkàn-an rẹ̀ kúrò, ó sọ fún Novaya Gazeta.
Ṣùgbọ́n ní alẹ́ ọjọ́ tí ètò náà ku ọ̀la, Shabuyeva sọ̀rọ̀ pé òun gba ìpè àjèjì láti orí òpó ẹ̀rọ-ìbánisọ̀rọ̀ kan tí kò ṣe é dámọ̀, ẹni náà sì sọ fún òun pé bí òun bá tẹ̀síwajú pẹ̀lú ètò náà bí ó ṣe ti pinnu, wọ́n máa fi igi ìgbábọ́ọ̀lù-afọwọ́jù pàdé àwọn àlejò rẹ ní ìta ilé-iṣẹ́ náà. Òun náà sì lè kojúu wàhálà, onípè àjèjì náà léríléka. Nítorí ìbẹ̀rù fún ààbò àwọn àlejòo rẹ̀, Shabuyeva fagilé ìfọ̀rọ̀wánilẹ́nuwò náà tí ó sì fi ètò mìíràn rọ́pòo rẹ̀.
Ìfẹ̀hónúhàn tí ó wáyé ní gbàgede ìlú wà lára ìkéde gbogboògbò #saveLGBTinRussia tí wọ́n fi ń polongo ìyà tí ó rorò tí wọ́n fi ń jẹ àwọn ènìyàn aṣe-ìbálòpọ̀-akọ-àti-akọ ní orílẹ̀ Chechnya. Àwọn ìwọ́de àti ìfẹ̀hónúhàn irú èyí wáyé ní àwọn ìlú mìíràn ní Russia.

Родина-мать призывает своих детей (граждан) бороться с ксенофобией и репрессиями в современной России. Очнитесь от её крика! #saveLGBTinRussiahttps://t.co/vpfTmPnCSM pic.twitter.com/blGzqv437E
— !Alliance | Альянс! (@hetero_for_lgbt) January 22, 2019
Ìlú ń ké pe àwọn ọmọ rẹ̀ (àwọn ọmọ ìlú) láti dojú ìjà kọ ìwà elẹ́yàmẹyà àti ìtẹ̀mọ́lẹ̀ ní Russia òde-òní. Jẹ́ kí ìpèe rẹ̀ ta ọ́ jí!
[àmì náà ń sọ pé: Ẹ̀KA ÌṢÈDÁJỌ́ TI ORÍLẸ̀-ÈDÈE RUSSIA Ò RÍ ÀWỌN AṢE-ÌBÁLÒPỌ̀-AKỌ-ÀTI-AKỌ NÍ CHECHYA. WỌ́N WÀ NÍBẸ̀: NÍNÚ ÀWỌN ỌGBÀ Ẹ̀WỌ̀N ÀTI IBOJÌ-ÒKÚ.
#SAVELGBTINRUSSIA Ẹ̀TANÚ ÌBÁLÒPỌ̀-LÁÀÁRÍN-AKỌ-ÀTI-AKỌ = ÌJỌBA AFIPÁMÚNI
Nínú oṣù Igbe 2017, Novaya Gazeta jábọ̀ pé àwọn aláṣẹ ní Chechnya, ti ìlú oníjọba Ìmọ́lẹ̀ tí ó ń rí ìdààmú jù ní gúúsù Russia tí ajagun fẹ̀yìntì Ramzan Kadyrov, ń ṣe olóríi rẹ̀, ń ṣe ìpolongo tí ó rorò tí ó ń tako ìtẹ̀mọ́lẹ̀ àwọn ènìyàn tí í ṣe LGBT tí ó ń gbé nínúu rẹ̀. Ìròyìn tí ó jáde ní àìpẹ́ sọ pé “ìfọ̀mọ́” náà le gidi gan-an ni, pẹ̀lú ikú èèyàn méjì ó kéré tán àti ogunlọ́gọ̀ àwọn tí ó wà ní àtìmọ́lé tí ó lòdì sí òfin.",https://yo.globalvoices.org/2019/02/08/206/,8 Èrèlé  2019
