title,content,link_to_resource,published_date
‘Ẹ Yé é Pa Àwọn Òbìnrin’ – ìpolongo tuntun tí ó ń tako ìjìyà inú ìgbéyàwó ní Angola,"Ìfẹ̀hànnúhàn hàn ní Luanda, Angola, pẹ̀lú àmì ìpolongo #Paremdematarasmulheres ní èdè Portuguese, tabí ‘ẹ yé é pa obìrin’, àwòrán láti ọwọ́ọ  Simão Hossi, a lò ó pẹ̀lú àṣẹ.
Nígbà tí wọ́n bá òkú agbẹjọ́rò tí ó jẹ́ ẹni ọdún 26, Carolina Joaquim de Sousa da Silva nínú ilée rẹ̀ ní ọjọ́ 3, oṣù Ọ̀pẹ ọdún 2018, ọkọ rẹ̀ jẹ́wọ́ ọ̀ràn náà, ó sì di èrò àhámọ̀ ẹ̀ka tí ó ń ṣe ìwádìí ìwà ọ̀daràn ti Angola tí a mọ̀ sí SIC.
Láàárín ọ̀sẹ̀ kan náà, ìròyìn ikú obìnrin kan ni ó jáde láti ilé-iṣẹ́ Amóhùn-máwòrán Gbogboògbò orílẹ̀-èdè Angola tí ó ní wípé ọ̀rẹ́kùnrin ìgbà-kan-rí obìnrin náà ni ó gún un pa.
Àwọn ọ̀ràn ìwà ọ̀darànmọràn yìí ti mú ọ̀pọ̀lọpọ̀ àwọn obìnrin ní orílẹ̀-èdè Angola dúró gírígírí, èyí sì fa ìpolongo tuntun kan tí ó ń tako ìjìyà abẹ́lé tí wọ́n pe àkóríi rẹ̀ ní “Ẹ Yé é Pa àwọn Obìnrin” tí Ẹgbẹ́ Ondjango tí ó jẹ́ àjọ ajàfúnẹ̀tọ́ obìnrin tí kì í ṣe ti ìjọba ṣe àgbékalẹ̀ẹ rẹ̀. Wọ́n ṣe àmúlò Facebook gẹ́gẹ́ bí ohun èlò ìkórajọ wọn, èròńgbà wọn ni láti jẹ́ kí àwọn ènìyàn mọ̀ nípa àwọn ìjìyà obìnrin ní orílẹ̀-èdè Angola:
Estes têm sido dias difíceis. Na verdade, para nós mulheres, muitos dias são difíceis e dolorosos porque ainda vivemos em contextos onde se justifica quase sempre, de uma ou de outra forma, todo o tipo de violência contra nós. E nestes últimos dias, em particular, ficou tudo ainda mais penoso por termos de lidar com as reacções que vieram à tona depois do caso de Carolina…
A violência contra as mulheres é real, é mesmo. Não é coisa da cabeça de feministas, não é invenção ou discurso vazio: É REAL! Carolina, infelizmente só acrescentou as estatísticas, houveram muitos outros casos antes dela que vieram a público e existem milhares de outros casos que não vêm a público. É um problema que está aí à porta, aos nossos olhos. E é um problema que extrapola relações entre um ou outro casal: é um problema estrutural.
Há uma estrutura que dita e relega as mulheres a papéis de subalternização que as torna em potenciais alvos de violência de todos os tipos e a todos níveis. Esta estrutura de supremacia masculina que paira sobre nós e muitos negam existir, e que não é invisível, faz isto: mutila e destrói as vidas das mulheres e MATA!
Nós, mulheres singulares e também enquanto colectivo, vamos continuar a gritar ‘parem de nos matar’ e de ‘ferir a nossa existência’. Queremos leis que nos protejam e sejam aplicáveis de facto, queremos políticas públicas que tragam aos debates e às instituições o respeito da nossa humanidade. Queremos uma sociedade onde não tenhamos medo de sair à rua! Vamos continuar a reivindicar uma sociedade onde tenhamos as nossas liberdades de ser, de sentir, de andar e pensar como quisermos. Vamos continuar a reivindicar uma sociedade onde possamos viver em segurança.
Àsìkò yìí jẹ́ èyí tí ó le. Lóòótọ́, fún àwa obìnrin ọ̀pọ̀lọpọ̀ ọjọ́ ni ó le tí ó sì ń dùn èèyàn nítorí pé a ṣì wà ní ipò tí ó jẹ́ pé a máa ń yẹra fún ìjìyà lọ́nà kan tàbí òmíràn. Láìpẹ́ yìí gan-an pàápàá, ó dunni láti máa kojú àwọn ìhùwàsí tí ó ń jáde lẹ́yìn ọ̀rọ̀ ti Carolina…
Lóòótọ́ ni ìjìyà àwọn obìnrin, ó wà lóòótọ́. Kì í ṣe ohun tí ó kàn wá lórí àwọn ajàfúnẹ̀tọ́ obìnrin, kì í sì í ṣe ọ̀rọ̀ àgbélẹ̀rọ tàbí ọ̀rọ̀ òfìfo, LÓÒÓTỌ́ NI! Ó ṣeni láàánú pé ti Carolina kún ìṣirò tí ó ti wà nílẹ̀, ọ̀pọ̀ ọ̀ràn báyìí ti wáyé kí tirẹ̀ ó tó ṣẹlẹ̀ tí àwọn ènìyàn gbọ́ sí, bẹ́ẹ̀ sì ni ẹgbẹẹgbẹ̀rún àwọn ọ̀ràn mìíràn tí àwọn èèyàn ò mọ̀ sí, ó jẹ́ ìṣòro kan tí ó ti wà níbẹ̀ lẹ́nu ọ̀nà níwájú wa. Ó sì jẹ́ ìṣòro tí ó ń ro ti ìbáṣe láàárín tọkọtaya – ìṣòro àtilẹ̀wá ni.
Ètò ìpìlẹ̀ kan wà tí ó ń pàṣẹ tí ó sì ń rẹ àwọn obìnrin sílẹ̀ sí ipò ẹ̀yìn tí èyí sì sọ wọ́n di olùfaragbá ìjìyà lóríṣiríṣi àti ní gbogbo ọ̀nà. Ètò fífi akọ ṣe olórí yìí tí ó ti kọ́ wa lọ́rùn tipẹ́ tí ọ̀pọ̀lọpọ̀ sì ń kọ̀ pé kò rí bẹ́ẹ̀ – ìyẹn kò sì ṣe é rí – ohun tí ó ń ṣe rè é: ó ń sọni di aláàbọ̀-ara, ó ń ba ayé àwọn obìnrin jẹ́, bẹ́ẹ̀ ló ń pani.
Àwa obìnrin lọ́kọ̀ọ̀kan àti àpapọ̀ọ wa, a máa tẹ̀síwajú láti máa pariwo kí ‘ẹ yéé pa wá’ kí ẹ sì ‘yéé ṣe wá léṣe’.
À ń fẹ́ àwọn òfin tí yóò dáàbò bò wá tí wọn yóò sì kún ojú ìwọ̀n, a fẹ́ àwọn ètò àmúlò gbogboògbò tí yóò mú àpọ́nlé wa lọ sí àwọn ìtàkùrọ̀sọ àti àwọn ìdásílẹ̀. A fẹ́ àwùjọ tí ẹ̀rù àtijáde ò ti ní bà wá! A máa tẹ̀síwajú láti béèrè fún àwùjọ tí a óò ti ní òmìnira ti ara, òmìnira ìmọ̀lára, òmìnira ìrìn àti òmìnira ríronú bí a ṣe fẹ́.
A máa tẹ̀síwajú láti béèrè fún àwùjọ tí a ti lè gbáyé pẹ̀lú ààbò tó péye.
Bẹ́ẹ̀, ìpolongo yìí mú èsì tí ó ń takoni wá láti ọ̀dọ̀ àwọn ọkùnrin kan tí wọ́n rí ìdí fún ìdáláre fún ìrúkèrúdò fífi ìyà jẹ obìnrin. Wọ́n pe ìpolongo wọn ní “Ẹ Yé é Dà Wá”, wọ́n gbà pé ìwà ọ̀dàlẹ̀ jẹ́ ìdí tí ó tọ́ láti máa fìyà jẹ obìnrin. Bíótilẹ̀jẹ́pé èrò wọn ò tí ì máa rinlẹ̀, Olórin Angola, Gill Slows Allen Russell náà sọ̀rọ̀;
Parem de trair os outros, por favor chegaaaaa de corno. É um grito de clamor, mulheres se não nos querem mais peçam divórcio antes de trair se não vão bazar mesm.
“Ẹ yé é da ẹlòmíràn, ẹ jọ̀wọ́ a ò fẹ́ aláìṣòdodo aya mọ́. À ń ké tantan, ẹ̀yin obìnrin bí ẹ kò bá nífẹ̀ẹ́ wa mọ́, ẹ béèrè fún ìtúká kí ẹ tó máa dà wa, ẹ máa lọ.
Onímọ̀ àwùjọ Mbangula Kemba sọ̀rọ̀ tako ojú tí wọ́n fi wo ọ̀rọ̀ yìí, ó tẹnumọ́ọ pé wọn ò gbọdọ̀ fi ìfìyàjẹni yanjú ìṣòro nínú ìgbéyàwó.
Angola fi ìdí òfin tí ó ń de ìfìyàjẹni tí wọ́n mọ̀ sí 25/11 múlẹ̀ ní ọdún 2011 tí ó ń sọ onírúurú ìfìyàjẹni abẹ́lé di ìwà ọ̀daràn ní gbangba. Síbẹ̀síbẹ̀, ìdájọ́ òfin yìí kò le tó, ìtìmọ́lé ọdún méjì sí mẹ́jọ.
Sizaltina Cutaia, tí í ṣe ajìjàǹgbara àti ajàfẹ́tọ̀ọ́ obìnrin ní Angola; tí ó jẹ́ ìlúmọ̀ọ́ká fún iṣẹ́ẹ rẹ̀ lórí ẹ̀tọ́ obìnrin béèrè fún ìṣàmúlò òfin náà lórí àwọn gbàgede ìtàkùrọ̀sọ lórí ẹ̀rọ-alátagbà:
Não basta só agravar as penas, senhora Vice Presidente do MPLA, é preciso que o Estado crie estruturas condições para combater a violência, os compromissos assumidos em 2007 por via da ratificação do protocolo de Maputo precisam de ser efectivados. Para além disso, há que criar estruturas para atender as vítimas e enact legislação complementar que garanta de facto a realização dos direitos das mulheres. Isso inclui toda a legislação em torno dos direitos sexuais e reprodutivos das mulheres.
Não adianta fazer discurso contra a violência doméstica e depois apoiar políticas que autorizem os fiscais e polícias diariamente agridam mulheres nas rua, é contraditório! 
Não adianta fazer discurso contra a violência doméstica e apoiar um OGE que não acautele os serviços sociais cujo subfinanciamento todas sabemos impacta negativamente a vida das mulheres. É preciso dar sentido aos discursos com accoes concretas. Put the money where the mouth is.
#paremdematarasmulheres
Àfikún ọdún ẹ̀wọ̀n kò tó, arábìnrin igbá-kejì Ààrẹ MPLA [Àjọ Àwọn ènìyàn tó fẹ́ ìdásílẹ̀ Angola], Ó nílò kí orílẹ̀-èdè ṣe ìdásílẹ̀ àwọn ìlànà àtilẹ̀wá tí yóò kojú ìpanilára – Àwọn ohun tí wọ́n fara mọ́ ní 2007 nípa àjọsọ ìlànà Maputo ní láti di ṣíṣe. Bákan náà ni ti èyí, ó nílò kí wọ́n ṣe ìdásílẹ̀ òfin arọ́pò tí yóò mú ẹ̀tọ́ àwọn obìnrin rinlẹ̀. Lára èyí ni gbogbo òfin tí ó de obìnrin ní ti ìbálòpọ̀ àti ẹ̀tọ́ ọmọ bíbí wà.
Kò sí ìwúlò ìsọ̀rọ̀ tako ìjìyà abẹ́lé kí ó wá di ẹ̀yìn wá kí a máa ṣe ìgbèlẹ́yìn àwọn òfin tí ó fi àṣẹ fún agbófinró láti yẹ̀yẹ́ obìrin ní títì ní ojúmọ́, kò bá ara mu!
Kò wúlò kí a máa sọ̀rọ̀ tako ìjìyà abẹ́lé kí a sì tún máa gbèlẹ́yìn àṣàrò ìnáwó tí kò ní ṣe ààbò ètò àwùjọ, ìṣúná àìtó tí gbogbo wa mọ̀ pé ipa òdì ni ó ń kó nínú ayé àwọn obìnrin. Ó ṣe pàtàkì kí a fi ọgbọ́n kún àwọn ọ̀rọ̀ náà pẹ̀lú ṣíṣe gidi. Ẹ fi owó yín sí ibi tí ẹnu yín wà.
#ẹyéépaàwọnobìnrin
Ajàfẹ́tọ̀ọ́ obìnrin Cecelia Kitombé sọ̀rọ̀ sí àwọn tí ó ń ṣe àtìlẹyìn ìbáṣepọ̀ tí ó níyà nínú:


Alguns dos que estão a dizer e a escrever textão contra violência as mulheres afirmando que está demais, são os mesmos que aconselham as filhas, irmãs e primas a continuarem em relações abusivas, sob pretexto de que na conversa de marido e mulher não se mete a colher, outros ainda te dizem continue, a vida a dois é mesmo assim… Há ainda aqueles que acham que a mulher pode tudo, mas nunca esquecer o seu “papel”…
Parem de nos matar!!!


Lára wa tí à ń tẹnumọ́ ọn pé ó pọ̀jù [láti sọ̀rọ̀ síta tako ìjìyà Abẹ́lé] náà ni ẹni tí ó ń gba àwọn ọmọbìnrin, arábìnrin àti ìbátan lóbìnrin níyànjú láti máa fi ara da ìbáṣepọ̀ tí ó ń pani lára pẹ̀lú ọ̀rọ̀-ẹ̀tàn pé ọ̀rọ̀ tọkọtaya ò ṣe é dá sí, àwọn mìíràn á ní kí o tẹ̀síwajú bẹ́ẹ̀, bí ọ̀rọ̀ lọ́kọláya ṣe rí nìyẹn… Àwọn kan tilẹ̀ rò pé obìnrin lè ṣe gbogbo nǹkan, ṣùgbọ́n wọn ò gbọdọ̀ gbàgbé ‘ojúṣe’ wọn.
Ẹ yéé pa wá!!!",https://yo.globalvoices.org/2019/01/12/150/,12 Ṣẹẹrẹ 2019
Ìwọ́de afẹ́ àwọn abódiakọ-akọ́diabo àkọ́kọ́ lè tú èrò nípa wọn ní Pakístánì ká,"Jannat Ali Pẹ̀lú àwọn alágbèékalẹ̀ láti ilé-iṣẹ́ Sathi àti Track-T. Àwòrán láti ọwọ́ọ Syed Noman. A lò ó pẹ̀lú àṣẹ.
Fún ìfẹsẹ̀múlẹ̀ ẹ̀tọ́ àti imúdiṣíṣẹ ìbéèrè wọn lábẹ́ òfin, ìwọ́de Afẹ́ Abódiakọ-akọ́diabo wáyé ní Lahore, Pakistan, lọ́jọ́ 29 oṣù Ọ̀pẹ ọdún 2018. Fún ìgbà àkọ́kọ́ nínú ìtàn ìlúu nì, àwọn Abódiakọ-akọ́diabo kò bẹ̀rù láti jáde síta nínú ibi ìkòkọ̀ wọn àti fún ìjọba láti mú òfin Ààbò Ẹ̀tọ́ Abódiakọ-akọ́diabo Ènìyàn ọjọ́ 24, oṣù Èbìbì 2018.

With changing times even Pakistan is becoming more accepting towards transgender! First ever transgender march in Pakistan took place in Lahore on Dec 29, 2019. I hope this will continue and maulvis won’t give out fatwas against it. https://t.co/Z0xM8vbCCq
— Nusrat Sohail (@NusratSohail1) January 2, 2019
Ìwé òfin ìlú Pakistan sọ wípé “A kò gbọdọ̀ fi ẹ̀tọ́ ìgbé ayé tàbí òmìnira du ẹnikẹ́ni ní ìbámu òfin,” tí ó wà lábẹ́ Àwọn Ẹ̀tọ́ ọmọ ìlú. Síbẹ̀, Abódiakọ-akọ́diabo ènìyàn ní ìtàn mìíràn láti sọ bí ó bá kan ti ẹ̀tọ́ àti ìgbé ayé; wọ́n ti jìyà oró, ìfipábánilòpọ̀, dáná sun wọ́n ní ààyè, bẹ́ wọn lórí àti yin ìbọn pa wọ́n, ìjọba kò fi torí gbogbo èyí ràn wọ́n lọ́wọ́ pẹ̀lú pé Ìjọba ti tari òfin Ààbò Ẹ̀tọ́ Abódiakọ-akọ́diabo Ènìyàn wọlé nínú oṣù Ẹrẹ́nà ọdún 2018.
Jannat Ali, tí orúkọ ìnagijẹ rẹ̀ ń jẹ́ Lahore's Trans Diva, ni olùdásílẹ̀ Abódiakọ-akọ́diabo Track Transgender àti Olùdarí Ètò fún Ilé-iṣẹ́ Sathi tí ó ṣe àgbékalẹ̀ Ìwọ́de Afẹ́ náà. Àwọn Abódiakọ-akọ́diabo mìíràn àti àwọn tí kì í ṣe Abódiakọ-akọ́diabo àmọ́ tí ó jẹ́ alátìlẹ́yìn náà kó ipa nínú ìyíde náà àti àṣeyọríi rẹ̀. Ilé-iṣẹ́ ìpìlẹ̀ Sathi jẹ́ ilé-iṣẹ́ fún àlàáfíà àti ìmójútó ààbò ẹgbẹ́ abódiakọ-akọ́diabo ní Pakistan.
Ìwọ́de Afẹ́ Abódiakọ-akọ́diabo ní Lahore. Oṣù Ọ̀pẹ, ọdún 2018. Syed Noman ni ó ní àwòrán. A lò ó pẹ̀lú àṣẹ.
Ènìyàn Abódiakọ-akọ́diabo tí ó tó bí 250 láti agbègbè jákèjádò ìlú Pakistan. Gbajúmọ̀ nínú wọn ni Kami Sid, Bebo láti Sindh, Nadra láti KPK, Anmol láti Agbègbè Sahiwal, Nayab láti Okara, Sunaina Khan (Oníjó ìbílẹ̀), Naghma àti Lucky (Akọrin Coke Studio), Laila Naz àti Neeli Rana. Ìpàdé oníròyìn ni a fi bẹ̀rẹ̀ ètò ní Ilé Ẹgbẹ́ Akọ̀ròyìn ní Lahore níbi tí wọ́n ti fi ẹ̀dùn ọkàn-an wọn hàn; lẹ́yìn náà ni wọ́n yide kiri dé Ilé Àṣà Al Hamra níbi tí wọ́n ti jó, kọrin lọ́nà, kí wọn ó tó fọ́nká lẹ́yìn tí wọ́n jẹun tán.
Pẹ̀lú pé ìpàdé fún oníròyìn wáyé ní Ilé Ẹgbẹ́ Akọ̀ròyìn Lahore, Ìyíde Ìgbéraga náà ó jáde nínú ìròyìn. Bíótilẹ̀jépé àwọn alágbèékalẹ̀ fi ìwé pe aláṣẹ ìlú, bí i Punjab MNA Saadia Sohail láti Pakistan Tehreek e Insaf, àwọn aláṣẹ kò yọjú. Ìyíde ọ̀hún fa awuyewuye lórí ẹ̀rọ-alátagbà níbi tí àwọn ènìyàn gbé oríyìn fún ìyíde kiri náà nígbà tí àwọn ènìyàn kan fẹ́ mọ ìdí tí ilé iṣẹ́ oníròyìn kò ṣe rò nípa rẹ̀.

https://t.co/2JEBMDkqSR
Why is there a media blackout regarding the Trans Pride march in Lahore, Pakistan?
— Nem (@NemmyDDS) January 6, 2019

This is wonderful ❤️ Pakistan’s first transgender pride march. It’s a shame that no one really reported on it, most likely because it doesn’t fit the narrative of a country defined simply by religious extremism. What defines it is it’s diverse people just like any other place. https://t.co/cKxlaerFHy
— Basit Mahmood (@BasitMahmood91) December 30, 2018
Ni ọ̀rọ̀ọ rẹ̀ alágbèékáa Jannat Ali ní:
The aim was to show positive and progressive image of Pakistan and how the country is slowly accepting us and we are gaining more space in the society. Pakistan is not only about terrorism and a conservative society there is more to us. We promoted our march along with our KhawajaSara (transgender) culture and traditions it was not the same type of march as it is held in US.
Ìyíde náà tún tẹnu mọ́ ìlọsíwájú àti ìbáṣepọ̀ rere láàárín ẹgbẹ́ abódiakọ-akọ́diabo; bákan náà ni ó tẹnu mọ́ ìyàsọ́tọ̀ àti rògbòdìyàn. Nítorí wípé kò sí iṣẹ́ fún wọn, àwọn abódiakọ-akọ́diabo ènìyàn  kò ní ṣíṣe ju kí wọn ó ṣe òwò nọ̀bì láti rí oúnjẹ òòjọ́. Látàrí ìbálòpọ̀ tí kò ní ààbò, ọ̀pọ̀ l'ó ti kó àrùn kògbéwékògbègbó HIV àti AIDS. Ìdánilẹ́kọ̀ọ́ ṣe kókó fún àjọ ọlọ́pàá àti oníṣègùn nítorí àwọn ni kì í mú ayé rọrùn fún Abódiakọ-akọ́diabo ènìyàn tí ó bá ra ọwọ́ ẹ̀bẹ̀ tàbí nílò ìrànlọ́wọ́ ètò ìlera.
A ti fi ẹ̀tọ́ àwọn abódiakọ-akọ́diabo yí iyẹ̀pẹ̀. Láti ọdún 2015, abódiakọ-akọ́diabo tí ó tó 500 ni a ti rán lọ sí ọ̀run alakákeji ní Pakistan , Jannat Ali sì tún sọ wípé Abódiakọ-akọ́diabo 60 ni a dá ẹ̀mí wọn ní ẹ̀gbodò ní ọdún tí ó kọjá.
Asad Zaidi túwíìtì nípa ojú tí àwọn ènìyàn Pakistan fi wo ẹgbẹ́ Abódiakọ-akọ́diabo:

RT'd a tweet about the trans pride march in Pakistan and lost a bunch of followers. Bye (:
— asad (@sad_zaidi) January 3, 2019
Nínú ọ̀rọ̀ọ rẹ̀ ní TEDxLahore ní ọdún 2017, Jannat Ali ṣe àlàyé ìrìnàjòo rẹ̀ gẹ́gẹ́ bí abódiakọ-akọ́diabo ní Pakistan lẹ́yìn ìgbà tí ó fi irú ènìyàn tí òun ń jẹ́ han ẹbí àti àwọn ènìyàn.

Òfin Ẹ̀tọ́ Ààbò Abódiakọ-akọ́diabo Ènìyàn ọdún 2018 tí a bu ọwọ́ lù nínú ilé ìgbìmọ̀ aṣòfin fi àṣẹ fún ọmọ ẹgbẹ́ náà láti gba ìwé àṣẹ ọkọ̀ wíwà, ìwé ìrìnnà, ní ẹ̀tọ́ láti pààrọ ìṣẹ̀dá ẹni nínú àkọsílẹ̀ ìlú àti Àjọ Ìforúkọsílẹ̀ (NADRA), ìfòpinsí ìjìyà, àyè láti kàwé, iṣẹ́ nínú káràkátà àti ètò ìlera láì sí ìyàsọ́tọ̀.
Òfin náà ní ìjọba yóò pèsè àyè ilé ààbò fún Abódiakọ-akọ́diabo ènìyàn, ètò ìlera àti ohun èlò ẹ̀kọ́ àti ilanilọ́yẹ. Wọ́n máa lè jẹ ogún àti ẹ̀tọ́ láti di ìbò.
Nayaab Ali (ní ìdúró), abódiakọ-akọ́diabo àkọ́kọ́ tí ó dújedupò nínú ìbò àpapọ̀ ọdún 2018, àti Neeli Rana, tí òun náà jẹ́ gbajúgbajà abódiakọ-akọ́diabo  ènìyàn. Ayàwòrán Ikọ̀ Afẹ́ Abódiakọ-akọ́diabo ni ó ní àṣẹ. A gba àṣẹ àtúnlòw lọ́wọ́ọ rẹ̀.
Pakistan ti ń sún kẹ́rẹ́ ní ti ìgbé ayé Abódiakọ-akọ́diabo. Díẹ̀ lára àwọn abódiakọ-akọ́diabo ènìyàn du ipò ìjọba nínú Ìbò ọdún 2018 fún ìgbà àkọ́kọ́. Ilé iṣẹ́ amóhùnmáwòrán ìbílẹ̀ kan gba Abódiakọ-akọ́diabo àkọ́kọ́ sí iṣẹ́ gẹ́gẹ́ bí atọ́kùn; Coke Studio, ètò orin, àwọn Abódiakọ-akọ́diabo méjì ni ó ti kópa ní orí ètò náà. slowly starting to make strides when it comes to transgender visibility.
Bí nǹkan ṣe ń ṣe ẹnu ire fún àwọn ọmọ ẹgbẹ́ Abódiakọ-akọ́diabo a sì ń gbà wọ́n gẹ́gẹ́ bí ènìyàn, ìrìnàjò náà kò yàrá. Síbẹ̀, ọ̀gọ̀rọ̀ ènìyàn ni ó ní ìgbàgbọ́ wípé àyípadà ọ̀tún ń bọ̀ fún àwọn ènìyàn wọ̀nyí láti gbé ìgbé ayé ìfọkànbalẹ̀ nígbà tí ẹ̀tọ́ ọmọnìyàn gbogbo ní ìlú á wà ní ọ̀gbọọgba ní ojú àwọn ènìyàn àti ní abẹ́ òfin.",https://yo.globalvoices.org/2019/01/11/138/,11 Ṣẹẹrẹ 2019
