title,content,link_to_resource,published_date
Àdàwólulẹ̀ ilé ayé-àtijọ́ ọlọ́dún-un 150 fi àìkáràmáìsìkí ìjọba sí àwọn ibi àjogúnbáa Bangladesh hàn,"Ẹgẹrẹmìtì “Jahaj Bari” kí ó tó di àdàwólulẹ̀. Òun ni ilé àkọ́kọ́ àyàgbé ní olú-ìlú Bangladeshi, Dhaka, a kọ́ ọ ní ọdún-un 1870. Àwòrán láti ọwọ́ọ Shakil Ahmed. A fi àṣẹ lò ó.
Ní Dhaka, ilé àjogúnbá ọlọ́gọ́rùn-ún ọdún kan di àdàwólulẹ̀ pátá ní alẹ́ ọjọ́ Ìtunu Àwẹ̀ 5, oṣù Òkúdù 2019. Ní nǹkan bíi ọdún-un 1870 ni a kọ́ ilé náà tí ó fẹ́ẹ́ dà bíi ọkọ̀ ojú-omi, tí àwọn ọmọ ìbílẹ̀ ń pè ní “Jahaj Bari”, òun sì ni ilé àyágbé àkọ́kọ́ ni olú-ìlúu Bangladesh. Àdàwólulẹ̀ tí a da ilé yìí ti mú kí àwọn ọ̀pọ̀ ènìyàn ó sọ ẹ̀dùn ọkàn-an wọn síta lórí àìbìkítà fún àwọn ilé tí ó jẹ́ ohun ìṣúra Dhaka.
Ìròyìn fi yé wípé àwọn ọmọ ẹgbẹ́ òṣèlú tí ó wà lórí ipò ìyẹn Awami League (AL) gbé ẹ̀rọ tatapùpù wá sí ibẹ̀, wọ́n sì da ilé náà wó. Àwọn tí ó wá ṣiṣẹ́ náà sọ wípé olóríi àwọn, ọmọ ìgbìmọ̀ ìbílẹ̀ (Dhaka-7) Haji Md. Salim, ti ra ilẹ̀ náà láti fi kọ́ ilé alájà tó pọ̀ sí ibùdó náà. Bákan náà àwọn alátìlẹ́yìn AL sọ wípé ilé àtijọ́ náà kò sí lóríi àwọn ibi àjogúnbá tí ó wà nínú àkọsílẹ̀.

Ọ̀kan lára àwọn Ọmọ Ìgbìmọ̀ láti iléeṣẹ́ HAJI SELIM sọ wípé òun ti ra tilétilẹ̀, àti pé ẹ̀tọ́ òun ni yálà láti fi ilé orí ilẹ̀ òun sílẹ̀ tàbí kí òun wó o. Ìdájọ́ Ilé-ẹjọ́ Gíga ńkọ́?… ó jọ bí ẹni pé ó…https://t.co/afLCbu0pWh
— usg.dhaka (@USG_Dhaka) 15, Òkúdù 2019
Ní ọjọ́ 13, oṣù Ògún ọdún-un 2018, Ilé-ẹjọ́ Gíga Dhaka pàṣẹ fún àjọ ìjọba tí ó ń rí sí ètò ìdàgbàsókè ìlú ní ìlànà tìgbàlódé ní Dhaka láti máà wó tàbí tún àwọn ilé àjogúnbá tí ó wà ní olú-ìlú náà tó bíi 2,200 kọ́. Jahaj Bari wà nínú àwọn ilé àkọ́pọ̀ Waqf (mortmain) tí kò ṣe é tà. Gẹ́gẹ́ bí alákòóso Bangladesh Waqf Administratioń ṣe sọ, gbígba àṣẹ pọn dandan láti gbé iṣẹ́ sílẹ̀, tà tàbí ṣe àtúnṣe sí ohunkóhun tí ó bá jẹ́ ti Waqf. Èyí kò rí bí ajàfẹ́tọ̀ọ́ AL náà ti ṣe wí, kò sí ohun tó jọ ọ́, kò sí àṣẹ tí ó ní kí wọ́n tà tàbí wó ilé tí à ń sọ̀rọ̀ọ rẹ̀ yìí.
Nínú oṣùu Ẹrẹ́nà ọdún-un 2019, a gbé ìgbésẹ̀ kan láti da ilé náà wó lulẹ̀. Urban Study Group, ẹgbẹ́ aṣiṣẹ́ ọ̀fẹ́-tí-kò-ní-èrè tí ó máa ń fi ààbò fún àwọn ohun àjogúnbá Dhaka Àtijọ́ fi ìwé ẹ̀dùn ìdáwọ́dúróo àdàwólulẹ̀ náà ránṣẹ́ sí àwọn tí ọ̀rán kàn, tí ó sì mẹ́nu ba àṣẹ Ilé-ẹjọ́ Gíga.
Síbẹ̀, bí ìwé ìròyìn ṣe jábọ̀, díẹ̀ lára àwọn ọmọ ìbílẹ̀ ń yọ̀ fún àdàwólulẹ̀ ilé náà. Wọ́n ò mọ̀ pé ilé náà ti di ẹgẹrẹmìtì, ó sì lè wò lulẹ̀ kí ó wó lù wọ́n—tí í ṣe àpẹẹrẹ àìmọ̀kanmọ̀kàn àwọn ènìyàn sí ìpamọ́ ohun àjogúnbá àti àtìlẹ́yìn fún àtúnṣe sí ilé àtijọ́ tí ó wà ní Bangladesh.
Àjogúnbá Ìṣẹ̀lẹ̀ Àtẹ̀yìnwá —ọ̀rọ̀ tí ò jẹ́ mọ́ nǹkan
Ọ̀pọ̀ ènìyàn l'ó fi ẹ̀dùn ọkàn-an wọn hàn nígbà tí wọ́n gbọ́ nípa àmúdipẹ̀tẹ́lẹ̀ ilé náà. Shuvra Kar kọ sí oríi Facebook:
ঐতিহ্য, ইতিহাস, কৃষ্টি এসব এদেশে গাল ভরা কথা!!
Àjogúnbá , ìtàn-ìṣẹ̀lẹ̀-àtẹ̀yìnwá, àṣá jẹ́ ọ̀rọ̀ tí kò já mọ́ nǹkan ní orílẹ̀-èdè yìí!
Òǹkọ̀wé Tania Kamrun Nahar tan ìmọ́lẹ̀ sí ìdí tí kò fi yẹ kí ilé yìí di àdàwólulẹ̀:
তিনতলা ‘জাহাজ বাড়ি’র দোতলায় ছিলো নকশা করা রেলিং, ছাদওয়ালা টানা বারান্দা। আর পুরো অবয়বজুড়ে নানা রকম কারুকাজ। কোণাকৃতির আর্চের সারি, কারুকাজ করা কার্নিশ। কলামে ব্যবহার করা হয়েছিল আয়নিক ও করিন্থিয়ান ক্যাপিটাল। পশ্চিম প্রান্তে আর্চ ও কলামের সাথেও নানারকম অলঙ্করণের ব্যবহার দেখা যায়। সব মিলিয়ে এই ভবনটিতে যে ধরনের অলঙ্করণের ব্যবহার, তা একে এক অনন্য মাত্রা দিয়েছিল। এ ধরনের অলঙ্করণ পুরান ঢাকায় আর কোনো ভবনে দেখা যায় না। সেদিক থেকে এর নান্দনিক গুরুত্বের জন্যই ভবনটি সংরক্ষণ করা প্রয়োজন।
Ilé alájà-mẹ́ta náà “Jahaj Bari” ní àwọn iṣẹ́ ọnà tí ó yàrà ọ̀tọ̀ lára ní ara irin àgbọ́wọ́lé gun àkàsọ̀. Iṣẹ́ ọnà aláràbarà ti orí òrùlé ibi ìbojúwòta gígùn. Ọ̀kanòjọ̀kan ọnà ni ó wà ní ara ilé náà — àwọn àràbarà ọnà abẹ́ àjà àti bẹ́ẹ̀ bẹ́ẹ̀ lọ. Àwọn òpó ní àwòṣe ọnà ilée ionic àti Corinthian. Ọnà ara ilé náà kọjá àfẹnusọ tí a kò le è rí lára àwọn ilé mìíràn ní àwọn agbègbè àtijọ́ọ Dhaka. Fún ìdí èyí, kò yẹ kí ilé náà di àdàwólulẹ̀.
Ọdún-un 1610 ni Dhaka di olú-ìlúu Bengal, ìyẹn ogójì ọdún sẹ́yìn. Ní sáàa Mughal àti ìjọba amúnisìn British, ọ̀pọ̀lọpọ̀ ilé tí a kọ́ ni ó ní ìtàn-ìṣẹ̀lẹ̀-àtẹ̀yìnwá àti àjogúnbá ìlú náà kan tí ó rọ̀ mọ́ ọn.
Àmọ́ púpọ̀ nínú àwọn ilé wọ̀nyí ni ó ti wó láti ọjọ́ pípẹ́. Àwọn tí ó ṣì ń dúró ti di ẹgẹrẹmìtì, èyí á mú kí àwọn kan ó máa lọ (ṣe ayédèrú ìwé láti) gbẹ́sẹ̀ lé ilé wọ̀nyí. Àpẹẹrẹ kan ni Bara Katra, àrágbáramúramù ilé tí ó ní ìtàn-ìṣẹ̀lẹ̀-àtẹ̀yìnwá tí Mir Abul Qasim, Diwan (alága ètò ìṣúná) ti ó jẹ́ ọmọba Shah Shuja Mughul kọ́ ní nǹkan bíi 1644 àti 1646. Ó jẹ́ nǹkan ìbànújẹ́ wípé ilé náà ti ṣe tán, ó lè wó nígbàkigbà látorí àìṣàtúnṣe, àìkáràmáìsìkí ohun àjogúnbá, àti ìbàjẹ́ tí àwọn tí ó gbé ilé láì gba àṣẹ ń fà.
Bara Katra. Àwòṣe ilé kíkọ́ ìbílẹ̀ Àárín gbùngbùn Asian caravanserais ni a fi kọ́ ọ, ó sì ní ọwọ́ọ àwòṣe Mughal náà.  Ragib Hassan ni ó ní àwòrán ní oríi Wikipedia. CC BY 2.5
Muntasir Mamun ti kọ àìmọye ìwé lóríi ìtàn-ìṣẹ̀lẹ̀-àtẹ̀yìnwá àti àjogúnbá ìlúu Dhaka. Ó kọ sínú ìwé ìròyìn ìbílẹ̀ẹ Bhorer Kagoj:
গত চার দশক বড়কাটরা ছোটকাটরা সংরক্ষণ করার জন্য কতো আবেদন-নিবেদন করলাম, কেউ শুনল না। আজ সেগুলো ধ্বংস করে ফেলা হয়েছে। প্রতœতত্ত্ব দপ্তর যেখানে লালবাগ কেল্লার দেয়াল ভেঙে ফেলে গাড়ি পার্কিংয়ের জন্য তখন আর কী বলা যায়! মূর্খতার বিরুদ্ধে আর কতো লড়াই করা যায়?
Mo ti rawọ́ ẹ̀bẹ̀ sí àwọn aláṣẹ fún ogójì ọdún tí ó kọjá láti gba àwọn ilé àjogúnbá bíi Bara Katra àti Choto Katra sílẹ̀ lọ́wọ́ àwọn tí ó fẹ́ pa ìtàn àtẹ̀yìnwá rẹ́. Ṣùgbọ́n kò sí ẹni tí ó dá mi lóhùn. Kí ni ká sọ? Nígbà tí ẹ̀ka tí ó ń ṣe àkópamọ́ sítám̀pù ti wo ògiri àtijọ́ àmọ̀káyée Lalbagh Fort láti fi ṣe àyè ìgbọ́kọ̀sí, báwo ni a ó ṣe dojú ìjà kọ ìwà òmùgọ̀?
Ilé oníròyìn orí-ayélujára kan ti ṣe àtẹ̀jáde àbájáde ìwádìí tí ó jinlẹ̀ nípa àìkáràmáìsìkí ìjọba lóríi àwọn ilé àjogúnbá àti àwọn alẹ́nulọ́rọ̀ tí ó ń gbìyànjú láti da àwọn ilé tí ó kù wó:
ইতিমধ্যেই শাঁখারী বাজারের হেরিটেজভুক্ত ১৪ নম্বর বাড়িটি ভেঙ্গে ফেলা হয়েছে। সুত্রাপুরের বড় বাড়িটির সিংহভাগই ধ্বংস করা হয়েছে। মোগল আমলের স্মৃতিবাহী বংশাল মুকিম বাজার জামে মসজিদ, সিদ্দিক বাজার জামে মসজিদ সংস্কারের নামে ধ্বংস করা হয়েছে। [..] এসব স্থাপনা রক্ষায় সরকারের সুস্পষ্ট নির্দেশনা থাকলেও রাজউক ও ডিসিসির কর্মকর্তারা রহস্যজনক ভূমিকা পালন করেছে। অনেকক্ষেত্রে এদের নীরবতা ঐতিহ্য ধ্বংস সহায়ক শক্তি হিসাবে কাজ করছে।
Ilé tí ó wà ní ipò.14 ní orí ìwé àkọsílẹ̀ àjogúnbá ti di wíwó. Apá kan lára àwọn ilé àwòṣífìlà tí ó wà ní Sutrapur kò ṣe é rí mọ́n. Iṣẹ́ àtúnṣe sí àwọn àjogúnbá ìgbàa Mughal ní mọ́ṣálááṣí Bangshal Mukim Bazar Jam-e àti mọ́ṣálááṣí Siddique Bazar Jam-e ti di ohun ìgbàgbé nítorí ojú àpá ò le è jọ ojú ara, ó ti yàtọ̀. [..] Àmọ́ ṣá, ó ní àṣẹ ìjọba tí ó fi ààbò bo àwọn ilé àjogúnbá, àwọn agbèfúnjọba ti agbègbèe Rajdhani Unnayan Kartripakkha àti Àjọ Ìlúu Dhaka kò ṣe ohun tí ó yẹ kí wọn ó ṣe. Àìṣojúṣe wọn ni ó fà á tí àwọn olóṣèlú olójúkòkòrò ṣe ń gba àwọn ilé àtijọ́ tí wọ́n sì ń dà wọ́n wó lulẹ̀.
Ẹgbẹ́ Urban Study ti ṣe àgbékalẹ̀ ìwọ́de àti àkójọ àwọn ènìyàn tí yóò fi ẹ̀hónú àdàwólulẹ̀ wọ̀nyí hàn. Bẹ́ẹ̀ náà ni wọ́n gbèrò láti ṣe ìkéde nípa ìdààbò bo àwọn ilé àjogúnbá tí ọ̀rán kàn.
Àwòrán ìsàlẹ̀ yìí ni àwọn ilé àjogúnbáa Bangladeshi tí àdàwólulẹ̀ ń bá:
Ilée Zamindar àtijọ́ kan ní Nazira Bazar ní agbègbèe Àtijọ́ọ Dhaka ti ń di wíwó lulẹ̀. Àwòrán láti ọwọ́ọ Shakil Ahmed. A lò ó pẹlú àṣẹ.
Aàfin Nimtali . Òun ni ibùgbé Gómìnà Dhaka ní ayée Ìjọba Mughal.  Ìloro àbáwọlé ìwọ̀-oòrùn-un ààfin náà nìkan ló ṣì ń dúró. Àwòrán láti ọwọ́ọ Shakil Ahmed. A lò ó pẹlú àṣẹ.
ShankhaNidhi । Èyí ni ilé ọgọ́rùn-ún ọdún sẹ́yìn mìíràn ní Dhaka. Láìsí àmójútó, ilé yìí ṣì dúró. Àwòrán láti ọwọ́ọ Shakil Ahmed. A lò ó pẹlú àṣẹ.
Northbrook Hall . tàbí  Lal Kuthi – Fritz Kapp ni ó ya àwòrán yìí ní ọdún-un 1904. Ilé yìí ṣì ń dúró lónìí. Oríi Wikipedia ni àwòrán yìí wà. Ojú Òde",https://yo.globalvoices.org/2019/06/22/411/,22 Òkúdù  2019
China fi ọwọ́ọ ṣìnkún òfin mú ayàwòrán eré orí ìtàgé nítorí pé ó tún àwòrán ìgò ọtí-líle kan tí ó ń tọ́ka sí Ìpanìyànnípakúpa Tiananmen pín,"Àwọn ìgòo Baijiu ń ṣe ìrántí ìpànìyànnípakúpa Tiananmen náà.
Jennifer Creery ni ẹni tí ó kọ ìròyìn yìí, tí Ilé Iṣẹ́ Atẹ̀wé Olómìnira Hong Kong sì tẹ̀ ẹ́ jáde ní ọjọ́ 24 oṣù Èbìbí ọdún-un 2019. Ohùn Àgbáyé ṣe ẹ̀dàa ìròyìn náà ní abẹ́ ìtọwọ́bọ̀wé àjọṣe pọ̀ ìkóròyìnjọ. 
Àwọn aláṣẹ ìjọba China ti fi ayàwòrán eré aṣakọ̀sílẹ̀-ìṣẹ̀lẹ̀ Deng Chuanbin sí àtìmọ́lé lẹ́yìn tí ó ṣe túwíìtì àwòrán ìgò ọtí-líle kan tí a sààmìi “64” sí lára – tí ó ń tọ́ka sí ọjọ́ burúkú Èṣù gbomi mu Ìpaninípakúpa tí ó wáyé ní Tiananmen Square ní ọjọ́ 4, oṣù Òkúdù ọdún-un 1989.
Ìgò ọtí-líle 64 
Ọdún-un 2016 ni a ṣe ìgòo ọtí-líle náà, ìyẹn ní ìrántí ọdún kẹtàdínlọ́gbọ̀n tí ìṣẹ̀lẹ̀ láabi ọjọ́ 4 oṣù Òkúdù wáyé. Orúkọ tí a pe ọtí-líle náà ni “8 wine 64″. Bí a ti ṣe ń pe “wine” ní èdèe Putonghua náà ni à ń pe “9”. Ààmì ara ìgò náà ní àwòrán “Ọkùnrin ọkọ̀-ogun” tí a kọ “Máà ṣe gbàgbé, máà ṣe sọ̀rètí nù”. Ó sì tún fi han gbangbagbàngbà pé Beijing ni a ti ṣe ọtíi wáìnì náà tí ó ní ìdá 64 iye ọtí-líle nínú tí ó sì ti wà nílé ìtajà fún ọdún mẹ́tadínlọ́gbọ̀n.
A fi ọwọ́ọ ṣìnkún òfin mú àwọn ọmọkùnrin orílẹ̀ èdèe China mẹ́rin, Fu Hailu, Zhang Jinyong, Luo Fuyu àti Chen Bing, ní ọdún-un 2016 fún ìṣẹ̀lẹ̀ ìgò ọtí-líle tí a sì fi ẹ̀sùn-un “rírú ìṣẹ́po agbáraiìlú sókè”.
Ìgbẹ́jọ́ Fu, Zhang àti Luo's wáyé ní ibìkan ní Ilé-ẹjọ́ Àwọn Ènìyàn Agbedeméjì Chengdu nínú oṣù Igbe. Ọ̀kọ̀ọ̀kan wọn gba ìdájọ́ ìgbà ọdún mẹ́ta ní ẹ̀wọ̀n pẹ̀lú ìdádúró ọdún mẹ́rin sí márùn-ún. Nítorí pé Chen kò gbà wípé òun dá ẹ̀ṣẹ̀, ó sì wà lábẹ́ẹ ṣìgún òfin.
Pẹ̀lú ìdádúró ìrànlẹ́wọ̀n, àwọn mẹ́tẹ̀ẹ̀ta ṣì wà lábẹ́ ìṣọ́:

#ChengduWineBottleCase: lẹ́yìn tí a dá wọn sílẹ̀, a fi ẹ̀rọ ẹ̀gbà ọwọ́ kan sí Hailu, Zhang Junyong àti Luo Fuyu lọ́rùn ọwọ́ èyí tí yóò máa ṣọ́ ibi tí wọ́n wà, ká ohùn/àwòrán sílẹ̀, ó sì ní ike pélébé tí ń darí gbogbo àkásílẹ̀ wọ̀nyí bí ó ṣe ń ṣẹlẹ̀ sí àgọ́ ọlọ́pà. https://t.co/4QGGZBBuat pic.twitter.com/AVF0bttMys
— CHRD人权捍卫者 (@CHRDnet) Ọjọ́ 22, oṣù Igbe ọdún-un 2019
Ìfọwọ́ọ ṣìnkún òfin múni nítorí àtúnpín túwíìtì 
Ní ìpalẹ̀mọ́ ìsààmì ọgbọ̀n ọdún tí ìṣẹ̀lẹ̀ ọjọ́ 4, ayàwòrán eré orí ìtàgé Deng Chuabin ti di ẹni tí ọ̀rọ̀ ìgò ọtí-líle 64 ń dá sẹ̀ríà fún lọ́wọ́lọ́wọ́. Ọlọ́pàáa Sichuan fi ọwọ́ọ ṣìgún òfin mú Deng ní ilée rẹ̀ ní Yibin ní ọjọ́ Ẹtì tí ó kọjá, lẹ́yìn wákàtí díẹ̀ tí ó ṣe àtúnpín àwòrán-an Twitter kan tí ó jẹ́ ti ìgò ọtí-líle 64, gẹ́gẹ́ bí Iléeṣẹ́-tí-kìí-ṣe-tìjọba, Adáààbòbo Ẹ̀tọ́ Ọmọ ènìyàn ti China (CHRD).
Ayàwòrán náà gba ìpè àwọn ọlọ́pàá lẹ́yìn-in ọgbọ̀n ìṣẹ́jú lẹ́yìn tí ó túwíìtì àwòrán náà pẹ̀lú wípé lẹ́sẹ̀kẹsẹ̀ ni ó mú un wálẹ̀, bẹ́ẹ̀ ni CHRD ṣe ti sọ. Àwọn ọlọ́pàá fi agbára gba ẹ̀rọ ìbánisọ̀rọ̀ alágbèéká mẹ́ta, ẹ̀rọ ayárabíàṣá kọ̀mpútà kan, ẹ̀rọ ayárabíàṣá àgbélétan kan, iPad, ike pélébé ìrántí àti ẹ̀rọ ayàwòrán kékeré kan nígbà tí wọ́n wá sí ilée rẹ̀. Deng ti wà ní Àtìmọ́lé Agbègbè Nanxi nítorí wípé “ó ń bá ìjà bọ̀” – ẹ̀sùn tí wọ́n sábà máa ń kà mọ́ àwọn ènìyàn tí ó ń takò ìjọba lẹ́sẹ̀.
CHRD sọ wípé fún wákàtí kan gbáko, àwọn ọlọ́pàá padà láti yẹ ilée Deng wò, wọ́n sì kó àwọn ẹ̀rọ lóríṣiríṣi:

林浩波：#邓传彬 案件更新：
2019年5月20日，有人通知邓的父亲去裴石镇派出所，邓父回来时还跟着几个人，在邓父母家里录像、拍照，在邓传彬的房间翻箱倒柜一个多小时，拿了二十件物品，包括多种电子设备的充电线，甚至把电饭煲的线也拿走了。21日，镇派出所长到邓父母家讲：不用为邓传彬请律师。 pic.twitter.com/8tVZz0WGPa
— CHRD人权捍卫者 (@CHRDnet) May 22, 2019
Ọ̀rọ̀ tí ó ń lọ nípa #Deng Chuabin: Ní ọjọ́ 20 oṣù Èbìbì ọdún-un 2019: Àwọn ọlọ́pàá àgọ́ọ Peizhi ránṣẹ́ sí bàbáa Deng. Àwọn kan tẹ̀lée padà sílé, wọ́n sì ya àwòrán nínú ilée wọn. Wọ́n tú yàráa Deng Chuabin wò fún bíi wákàtí kan, wọ́n sì gbé ẹ̀rọ 20 àti agbaná sí ara ẹ̀rọ. Wọ́n tún ṣe bẹ́ẹ̀, wọ́n mú okùn ìkòkò ìse-ìrẹsì. Ní ọjọ́ 21, àwọn ọlọ́pàá sọ fún àwọn òbíi Deng láti máà gba agbẹjọ́rò fún un.
Deng, tí a tún mọ̀ sí Huang Huang, tí ó jẹ́ ayàwòrán aládàádúró tí ó ti bá òǹyàwòrán Beijing, Ai Weiwei ṣiṣẹ́ papọ̀. Ó sọ wípé òun ti ní ìdojúkọ ìjọba, pẹ̀lú àtìmọ́lé ní ọdún-un 2015 láti dénà dè é kí ó máà lọ sí ìdánilẹ́kọ̀ọ́ ẹ̀tọ́ ọmọnìyàn ní Geneva.
Oṣù tí ó ń bọ̀ ni ó sààmì ọgbọ̀n ọdún tí ìpaninípakúpa Tiananmen Square wáyé. Lọ́dọọdún, àwọn aláṣẹ China fi ọwọ́ agbára mú ìrántí ìṣẹ̀lẹ̀ náà, tí wọ́n sì fi àwọn agbọ̀rọ̀dùn sí àtìmọ́lé.",https://yo.globalvoices.org/2019/06/08/402/,8 Òkúdù  2019
