title,content,link_to_resource,published_date
Ilé ẹjọ́ gíga Tanzania pa á láṣẹ fún ìfòpinsí ìsoyìgì láàárín àgbàlagbà àti ọmọdé láì wo ti ìgbésẹ̀ ìmúpadàa rẹ̀,"Àwọn Ọmọiléèwé ọmọdébìnrin ní Tanzania dúró fún àwòrán lọ́jọ́ 10 oṣù Agẹmọ ọdún-un, 2007. Fanny Schertzer ni ó ya àwòrán, a lò ó pẹ̀lú àṣẹ láti Wikimedia Commons, CC BY 2.0.
Nínú oṣù Ọ̀wàrà 2019, ilé ẹjọ́ gíga Tanzania ṣe ìdímú ṣinṣin ìdájọ́ ọdún-un 2016  tí ó pàṣẹ ó kéré jù, ọmọbìnrin àti ọmọkùnrin gbọdọ̀ pé ọmọ ọdún méjìdínlógún kí ó tó ṣe ìgbéyàwó.
Àjọ ọba orílẹ̀ èdèe Tanzania gbéègbésẹ̀ láti ṣe ìmúpadà ìpinnu yìí, nítorí wípé àwọn ọmọdébìnrin ń yára bàlágà àti wípé ààbò ni ìgbéyàwó jẹ́ fún ọ̀dọ́bìnrin aláboyún. Àmọ́ ní ọjọ́ 23 oṣù Ọ̀wàrà ọdún-un 2019, ìjọba orílẹ̀ èdèe Tanzania pàdánù ẹjọ́ọ kòtẹ́milọ́rùnun rẹ̀ tí àṣẹ ilé ẹjọ́ gíga ṣì dúró: akọ àtabo gbọdọ̀ pé ọjọ́ orí méjìdínlógún kí wọn ó tó ṣe ìgbéyàwó, tí èyí sì ń fi agbára kún ìgbẹ́sẹ̀ ìsoyìgì ọmọdé ní Tanzania. 
Gẹ́gẹ́ bí United Nations Population Fund (UNFPA) ti ṣe wí, Tanzania ni ìsoyìgì ọmọdé pọ̀ sí jù lọ lágbàáyé. 
Àwọn ọmọ orí ayélujára ṣíra láti fi ìdùnnúu wọn hàn lóríi ìdájọ́ náà. Àwọn kan kí Rebeca Z. Gyumi, aláfisùn àti ẹni tí ó lé wájú nínú ọ̀ràn ìsoyìgì àwọn ọmọdé náà. Gyumi ni olùdásílẹ̀ àti alákòóso àgbà Msichana Initiative (Ètò fún àwọn Ọ̀dọ́mọbìnrin), iléeṣẹ́ tí kì í ṣe tìjọba tí ó ń ró àwọn ọmọdébìnrin lágbára nípasẹ̀ ti ẹ̀kọ́ ìwé.

A real #supadada!!Hongera @RebecaGyumi @Advocate_Jebra and team. I remember your journey started in 2016, I witnessed the first win, and you kept on fighting to #endchildmarriage Tokomeza #NdoaZaUtotoni
?????? pic.twitter.com/Rel6fwFs0R
— supadada (@tulanana) October 23, 2019

#supadada tòótọ́!!! Hongera @RebecaGyumi @Advocate_Jebra àti ikọ̀ọ rẹ̀. Mo rántíi wípé ìrìnàjòo rẹ bẹ̀rẹ̀ lọ́dún-un 2016, mo jẹ́ ẹlẹ́rìí sí ìboríì rẹ àkọ́kọ́, ó sì n ja ìjà ìfòpinsí ìsoyìgì ọmọdé #endchildmarriage Tokomeza #NdoaZaUtotoni
?????? pic.twitter.com/Rel6fwFs0R
— supadada (@tulanana) October ọjọ́ 23 oṣù Ọ̀wàrà, ọdún-un 2019
Mohammed Dewji, oníṣòwò àti olóṣèlúu nígbà kan rí, gbóríyìn fún ìpinnu náà gẹ́gẹ́ bí ìborí fún àwọn obìnrin ní Tanzania:

?? What a win for girls in Tanzania! The #Tanzania Court of Appeal has upheld the landmark 2016 ruling by the High Court which set the minimum age of marriage for girls from the age of 14 to 18! Hongera kwa wasichana wote wa Tanzania ?? #AChildIsNotAWife #EndChildMarriage. pic.twitter.com/flpILFeNTq
— Mohammed Dewji MO (@moodewji) October 23, 2019

Ìjáwé olúborí fún àwọn ọmọdébìnrin Tanzania ni èyí! Ilé Ẹjọ́ọ Kòtẹ́milọ́rùn #Tanzania náà ti di ìdájọ́ ọdún-un 2016 ti Ilé Ẹjọ́ Gíga tí ó sún ọjọ́ orí tí ó kéré jù lọ fún ìsoyìgì fún obìnrin láti 14 sí 18! Hongera kwa wasichana wote wa Tanzania ?? #AChildIsNotAWife #EndChildMarriage. pic.twitter.com/flpILFeNTq
— Mohammed Dewji MO (@moodewji) Ọjọ́ 23, oṣù Ọ̀wàrà ọdún-un 2019
Ọmọ orí ayélujára Lydia Charles pè é ní “ìpinnu tí ó dára jù lọ láti ṣe”:

This is best Decision the court has ever made. So much to celebrate. Hongera kwa wasichana wote wa Tanzania. Hongereni @MsichanaUwezo team kwa kuongoza hili #NdoaZaUtotoni
— Lydia Charles (@Lydiacharles_) October 23, 2019
Ìgbésẹ̀ láti fòpin sí ìsoyìgì ọmọdé ní Tanzania
Lọ́dún-un 2016, Gyumi na ọwọ́ ìka àbùkù sí agbára Òfin Ìgbéyàwó; Law of Marriage Act, 2002 (LMA) tí ó gba obìnrin tí kò tó ọmọ ọdún méjìdínlógún láyè láti ṣe ìgbéyàwó.
Gẹ́gẹ́ bí ìwádìí nípa ìlera Tanzania Demographic and Health Survey (TDHS) ṣe ti ṣàlàyé, ìdá 36 obìnrin tí ọjọ́ oríi wọ́n wà ní 25-49 ní í ṣe ìgbéyàwó kí wọn ó tó pé ọmọ ọdún méjìdínlógún, tí àwọn akẹgbẹ́ẹ wọn lọ́kùnrin sí jẹ́ ìdá 5.
Òfin LMA fi àyè gba ọmọdébìnrin tí ọjọ́ oríi wọn kò ju ọdún mẹ́rìnlá lọ láti ṣe ìgbéyàwó pẹ̀lú ìlọ́wọ́sí ilé-ẹjọ́, ìlọ́wọ́sí òbí fún ọmọ ọdún márùn-ún-dínlógún, nígbà tí ọdún méjìdínlógún jẹ́ ọjọ́ orí tí ó kéré jù lọ fún ọmọkùnrin.
Nípasẹ̀ àwọn aṣojú rẹ̀, Gyumi ṣàlàyé wípé àlàálẹ̀ LMA kọ iyán obìnrin kéré nítorí pé ó fún àwọn ọkùnrin ní àǹfààní ju àwọn obìnrin lọ. Nítẹ̀síwájú, wọ́n sọ wípé àlàálẹ̀ náà fi ẹ̀tọ́ dídọ́gba ọmọ ènìyàn yí ẹrẹ̀fọ̀ àti pé wọn fi ẹ̀tọ́ àǹfààní sí ẹ̀kọ́ ìwé dun àwọn ọmọdébìnrin.
Gyumi rọ Ilé-ẹjọ́ Gíga láti gbé àlàálẹ̀ LMA tì sẹ́gbẹ̀ẹ́.
Ilé-ẹjọ́ Gíga kò ṣe bẹ́ẹ̀. Àmọ́ wọ́n rí i lóòótọ́ wípé kò bá òfin mu wọ́n sì fún ìjọba lọ́dún kan láti ṣe àtúnṣe sí ohun tí kò tọ̀nà nínú àlàálẹ̀ LMA. Nípasẹ̀ aṣojú àgbà àwọn adájọ́, a pa ìjọba láṣẹ láti gbé ọjọ́ orí ìgbéyàwó sí ọdún méjìdínlógún fún obìnrin àti ọkùnrin.
Síbẹ̀, aṣojú àgbà àná banújẹ́ sí ìdájọ́ náà ó sì kọ ìwé àtúnpè-ẹjọ́ sí Ilé-ẹjọ́ Gíga náà:

So I've jst been notified by my advocate, that Office of Attorney General has served me a notice of appeal to HC decision on #ChildMarriage
— RebecaGyumi (@RebecaGyumi) July 28, 2016
Nínú oṣù Ọ̀wẹwẹ̀ ọdún-un 2017, Masaju pe ẹjọ́ọ kòtẹ́milọ́rùn ní ìtako ìdájọ́ ọdún-un 2016.

Rasmi:Nimeletewa document za serikali kukata rufaa kwenye kesi ya #NdoazaUtotoni. Kesi no 204 ya Sept 2017 pic.twitter.com/xrJu8p66tW
— RebecaGyumi (@RebecaGyumi) September 21, 2017
Pẹ̀lú ìfọwọ́sí àṣẹ ìjọba: mo ti gba ìwé àtúnpè-ẹjọ́ lóríi ẹjọ́ #childmarriage. Ẹjọ́ òǹkaye 204 ti oṣù Ọ̀wẹwẹ̀ ọdún-un 2017.

Kà síwájú sí i: Mozambique sọ ìsoyìgì ọmọdé di ìwà ọ̀daràn

Àyè fún àtúnpè-ẹjọ́
Láàárín oṣù mẹ́rin ìgbẹ́jọ́, ìjọba gbèrò láti ṣe àtúnpè-ẹjọ́ ọdún-un 2016 tí yó ṣe àtúnṣe sí àlàálẹ̀ LMA èyí tí ó fi àyè gba ọmọdébìnrin ọlọ́jọ́-orí márùn-úndínlógún gẹ́gẹ́ bí ẹni tí ó ti bàlágà fún ìgbéyàwó. Atẹ́jọ́pè, tí ó jẹ́ aṣojú àwọn adájọ́ ìpínlẹ̀, Mark Mulwambo àti Alesia Mbuya, ṣe àgbékalẹ̀ ìyàtọ̀ ìwà ẹ̀dá obìnrin àti ọkùnrin tí wọ́n sì fi àṣà ìbílẹ̀ àti òfin ẹ̀sìn Ìmàle gbá àtúnpè-ẹjọ́ náà nídìí.
Ms. Mbuya sọ wípé ìyàtọ̀ ìwà ẹ̀dá fi ọmọdékùnrin àti ọmọdébìnrin sí “ìsọ̀rí ọ̀tọ̀ọ̀tọ̀” àti pé, òfin fi ojú ọ̀tọ̀ọ̀tọ̀ wò wọ́n. Ó sọ síwájú sí i wípé nítorí àwọn ọmọdébìnrin máa ń tètè bàlágà ju ọmọdékùnrin lọ ni òfin fi la àlàálẹ̀ bẹ́ẹ̀. Ó sọ wípé ìgbéyàwó lè fi ààbò bo ọmọdébìnrin tí kò sí nílé ọkọ tí ó ti di abaraméjì láì tó ọjọ́ orí tí ó tọ́.
Ó sọ síwájú sí i wípé ilé ẹjọ́ kùnà bí ó ṣe “ṣe ìmúdọ́gbandọ́gba ọjọ́ orí ọmọ àti ọjọ́ orí tí ó yẹ fún ìgbéyàwó”, èyí tí ó túmọ̀ sí wípé ọ̀tọ̀ ni ti tọ́lú ọ̀tọ̀ ni ti tọ́lùú wò, ọ̀tọ̀ ni ó yẹ kí ilé ẹjọ́ ó là kalẹ̀ fún ọjọ́ orí ìgbéyàwó ọkùnrin àti obìnrin.
Àwọn ọmọ orí ayélujára ti yára bu ẹnu àtẹ́ lu ìdí tí àtẹ́jọ́pè fi sílẹ̀ nínú ìgbẹ́jọ́.

Be afraid of people who can justify stupidity ?
“Tanzania's attorney general launched an appeal, one of its claims was that child marriage could protect unmarried girls who get pregnant.”
“Tanzanian court upholds law banning child marriage – CNN https://t.co/P3VbmJt4tr“
— gatuyu (@Gatuyu) October 24, 2019

Kà síwájú sí i: Mozambique, Cote d'Ivoire gbé ìgbésẹ̀ akọni fún ẹ̀tọ́ àwọn obìnrin àti ọmọdé

Dídọ̀gba abo atakọ
Ìdájọ́ ilé ẹjọ́ náà jẹ́ atọ́ka sí ìfòpinsí àwọn àṣà tí ó ń mú ìpalára bá àwọn ọmọdébìnrin àti onírúurú ẹlẹ́yàmẹyà tòun ìfọwọ́rọ́sẹ́yìn àwọn ọmọdébìnrin ní Tanzania. Ní ti àjọ United Nations, kí a tó lè yege níbi ti dídọ́gba abo atakọ ní ọdún-un 2030, ìjọba ní láti ṣe àyípadà òfin ìyàsọ́tọ̀ọtọ̀ àti ṣíṣe àmúlò ìṣòfin tí yóò mú ìmúdọ́gba tí à ń sọ wáyé.
Àbájáde ìwádìí ṣe àfihàn-an rẹ̀ wípé ọjọ́ orí tí ó tọ́ láti ṣe ìgbéyàwó bá ìpele ìwé tí ènìyàn kà àti ọrọ̀ tí ènìyán ti kó jọ (TDHS 201) tan.  Ní Tanzania, ó ní ìyàtọ̀ ọdún mẹ́fà tí ó wà láàárín ọmọdébìnrin tí kò lọ sí ilé ìwé àti àwọn tí ó ka ìwé gíga tàbí ìwé gíga jù lọ.
Ní Tanzania, ohun tí kò bá òfin mu ni kí a fẹ́ tàbí fún akẹ́kọ̀ọ́bìnrin lóyún, ẹ̀wọ̀n ọgbọ̀n ọdún ni ẹní bá tasẹ̀ àgẹ̀rẹ̀ sófin yóò fi gbára. Akẹ́kọ̀ọ́bìnrin tí ó bá lóyún kì í padà sí ilé ìwé pàápàá tí ó bá bímọ tán.
Ìfòfinde ìsoyìgì pẹ̀lú ọmọdé máa ń fi ààbò fún àwọn ọmọdébìnrin, láì ro bí wọ́n ṣe wọ ilé ìwé. Ní Tanzania, ìgbéyàwó ọmọdébìnrin kì í jẹ kí ọmọdébìnrin ó kàwé tí wọn kò sì ní àǹfààní láti parí ẹ̀kọ́ọ wọn, gẹ́gẹ́ bí èsì ìwádìí láti Tanzania National Survey, 2017 ṣe ní i lákọsílẹ̀.
Ìfòfinde ìsoyìgì yìí ṣe àgbékalẹ̀ ìgbé ayé tó dára fún akẹ́kọ̀ọ́bìnrin láti parí ẹ̀kọ́ọ wọn láì sí ìdádúró. Pẹ̀lú bẹ́ẹ̀, akẹ́kọ̀ọ́bìnrin tí ó bá fẹ́rakù ṣì ń kojú òfin tí ó ní wọn kò gbọdọ̀ padà wá sílé ìwé.",https://yo.globalvoices.org/2019/11/11/520/,11 Bẹlu  2019
Àyájọ́ Ọjọ́ Òmìnira ní Trinidad àti Tobago — àmọ́ ǹjẹ́ orílẹ̀-èdè náà ní òmìnira bí?,"Ère Orin Ìràpadà, Ọgbà Òmìnira, Jamaica. Àwòrán láti ọwọ́ọ Mark Franco, a gba àṣẹ láti lò ó.
Ọjọ́ 1 oṣù Ògún ni ọ̀pọ̀ agbègbè tí ó wà ní Caribbean mọ̀ sí Àyájọ́ Ọjọ́ Òmìnira, tí í ṣe ọjọ́ tí a máa ń sààmi ìgbòmìnira àwọn ọmọ Adúláwọ̀ t'ó jìyà ní àsìkò okòwò ẹrú orí òkun atlantic.
Trinidad àti Tobago jẹ́ àkọ́kọ́ nínú àwọn orílẹ̀-èdè ní àgbáyé tí yóò ya ọjọ́ sọ́tọ̀ láti fi sọríi ìfòpin sí òwò ẹrú, àmọ́ lẹ́yìn-in 34 ọdún tí ìsinmi àpapọ̀ náà fi ẹsẹ̀múlẹ̀ àti ọdún 185 lẹ́yìn-in tí Àbá òfin Ìfòpin sówò-ẹrú kọ́kọ́ wáyé, awuyewuye ṣì ń lọ lóríi wípé bóyá erékùṣù-ìbejì olómìnira náà ní òmìnira tàbí kò ní.
Nínú ọ̀rọ̀ọ rẹ̀ nípa òmìnira ní ọjọ́ 27, ọdún-un, Alákòóso Ìlú Dókítà. Keith Rowley ṣàkíyèsí wípé ní àárín àwọn ọmọ bíbíi Trinidad àti Tobago, àwọn tí ó jẹ́ ọmọ Adúláwọ̀ “kol ṣe dáadáa tó bí ó ṣe yẹ”. Rowley sọ wípé ìwà-ipá tí í ṣe ti ènìyàn dúdú, ìrírí ọ̀dọ̀, ní láti máa ṣe ìwúrí fún àwọn ọmọìlú láti “fiyèsí, ṣe àfihàn àti ṣe ìtàkùrọ̀sọ pàtàkì nípa ibi tí a wà gẹ́gẹ́ bí orílẹ̀-èdè”.
Alága Ìgbìmọ̀ Àtìlẹ́yìn Òmìnira ti orílẹ̀-èdè náà, Khafra Khambon, gbà.
Àwọn ìwé àpilẹ̀kọ kan sí olóòtú fi àwọn àpẹẹrẹ okòwò ẹrú ìgbàlódé láwùjọ hàn èyí tí ó fi hàn wípé òmìnira tòòtọ́ ṣì ku díẹ̀ káàtó, nígbà tí àwọn mìíràn gbìyànjú láti sọ ọ́ di ọ̀rọ̀ òṣèlú, bí wọ́n ṣe ń tako àwọn iṣẹ́ ìlú àti àṣà.
Ìwé ìròyìn Trinidad Express yàn láti kọ èròo rẹ̀ nípaÀyájọ́ Ọjọ́ Òmìnira tí ó dábàá wípé Rowley, Kambon, àti ajàfẹ́tọ̀ọ́ ọmọ-ènìyàn Pearl Eintou Springer ṣì sọ nígbàtí wọ́n sọ ìdí tí àwọn ọmọìlú Trinidad àti Tobago tí ó jẹ́ ènìyàn dúdú ò fi ṣe dáadáa tó:
Ó rọrùn fún ẹgbẹ́ tí ó dúró ṣinṣin láti dá ètòo ẹlẹ́yàmẹyà àti ìtẹ̀bọlẹ̀. Àwọn tí kò bá ètò náà lọ yóò di aláìṣetó tí wọ́n á sì di ẹni àgbésẹ́yìn sí ipò kejì tàbí èyí tí ó burú ju bẹ́ẹ̀ lọ. […]
Ọ̀pọ̀lọpọ̀ àwọn ètòo wa, ẹ̀kọ́ tí í ṣe baba, ń gbé àwọn ènìyàn sí ipòo tálákà, kò sì fún wọn ní àǹfààní lẹ́ẹ̀kan sí i. Gbogbo ètò ni ó ní òṣùwọ̀n, tí ó ṣì jìnà gbégbérégbé sí òkè. Àwọn tó bá ara wọn ní ìsàlẹ̀ ní ìṣòro láti bá àwọn tí ó wà ní òkè ṣe. Iyì-ara-ẹni máa ń relẹ̀, tí èyí yóò sì mú wọn hu ìwà-ipá láti jà fún ẹ̀tọ́ọ wọn láwùjọ.
Ajábọ̀-ìròyín Arthur Dash gbóríyìn fún “ìṣẹ̀lẹ̀-àtẹ̀yìnwá ìdàgbàsókè” orílẹ̀-èdè náà ní ti ọ̀ràn-an ẹ̀yà, àmọ́ ó tún dá àbá wípé ìṣòro náà ju bí àwọn ti ṣe rò lọ, ó sì mú u ní àbá pé ó yẹ kí ọ̀rọ̀ alákòóso ìlú jẹ́ ìwúrí fún ọmọìlú láti ṣe ìwádìí fínnífínní sí bí ẹlẹ́yàmẹyà nínú ilé-iṣẹ ṣe ń pín àwọn ènìyàn sọ́tọ̀ọ̀tọ̀.
Àwọn òǹlò ẹ̀rọ-alátagbà sọ ti wọn. Òǹlò Facebook Adrian Raymond sọ:
Ní ọjọ́ òní a ṣe ìrántí àti ìsààmì òmìnira àwọn babańláa wa nínú ìgbèkùn ara ti òwò ẹrú.
Ní òní, lẹ́yìn ọ̀pọ̀lọpọ̀ ọdún, àwa ọmọ ẹrú tí à ń jà fitafita fún àjogúnbá ìjọba amúnisìn.
Àwọn àjogúnbá tí ó gbèèrú àti tí ó ní ìmúgbòrò ti di gbẹndẹ́kẹ: A ò kí ń ṣe òǹrorò, a ò kí ń ṣe oníjàgídíjàgan, a ò kí ń ṣe apanijẹ, a ò kàn kí ń ṣe ọ̀daràn àti ọmọ-ìta. Olórí ni wa, aronújinlẹ̀ ni wa, ọlọ́pọlọ pípé ni wa, onímọ̀ ni wa. Obama ni wá, Garvey ni wa, Marley ni wa, Angelou ni wa, Walcott ni wa. […]
Ẹ jẹ́ ká mọ̀ wípé ìyàsọ́tọ̀ọ̀tọ̀ nípa ti àwọ̀ ara ni ogún tí ó ń pín wa níyà […]
Ẹ jẹ́ kí á ṣe ìṣèlú tó kún fún ọ̀wọ̀; ẹ dẹ́kun à ń ba dúdú jẹ́ ní etí àwọn ènìyàn […]Ẹ jẹ́ ká ṣ’àjọyọ̀ àtúnrí àwọn ìgbàgbọ́ọ wa. Wọ́n gba ẹ̀sìn àwọn babańláa wa, wọ́n mú ìgbàgbọ́ àti ohun iyìi wa kúrò ní ọkàn-an wa. Ní ayé òde òní tí ẹ̀rọ ayélujára mú iṣẹ́ ìwádìí rọrùn, ó yẹ kí o ṣe àyẹ̀wò sí ìgbàgbọ́ àwọn babańláa wa, ìbọ̀wọ̀ àti ìmọrírì àgbà, gbígba ìwùsàsí ẹni […] ìtẹnumọ́ ẹwùn àti èrè ìwà ẹni, ìgbàgbọ́ ń bẹ nínú ẹbí, nínúu mọ̀lẹ́bí, nínú ìletò, nínúu àdúgbó.
Òmìnira yìí faramọ́ ẹni tí o jẹ́, ibi tí o ti ṣẹ̀ wá, ẹ̀jẹ̀ àti ìṣẹ̀lẹ̀-àtẹ̀yìwá tí ó wà nínú iṣan-ẹ̀jẹ̀. Gbá iyìi rẹ̀ mú, àṣàà rẹ, àti ìdánimọ̀ọ rẹ.",https://yo.globalvoices.org/2019/08/06/439/,6 Ògún  2019
