title,content,link_to_resource,published_date
Àfilé iye owó fún gbígba ìwé ẹ̀rí ọmọ-ìlú-fún-ìrìnnà mú àwọn ọmọ Angola fi ẹ̀hónú hàn,"Ní ibi ìfẹ̀hónúhàn ní Luanda, àmì náà sọ pé “30.500 Kwanzas kì í ṣe kékeré”. Àwòrán láti ọwọ́ọ Fernando Gomes, a gba àṣẹ láti lò ó.
Inú ń bí àwọn ọmọ orílẹ̀-èdè Angola látàrí iye owó ìwé ẹ̀rí ọmọ-ìlú-fún-ìrìnnà tuntun 30,500 kwanzas (ó tó 97 owó dollar) tí ìjọba ṣẹ̀ṣẹ̀ polongo ní ọjọ́ 21 oṣù Ṣẹẹrẹ. 2500 kwanzas (owó dollar orílẹ̀-èdè US mẹ́jọ) ni ó jẹ́ tẹ́lẹ̀tẹ́lẹ̀.
Ní àfikún, ìjọba ti pín iye owó irúfẹ́ ìrìnàjò tí ó wà sí ọ̀tọ̀ọ̀tọ̀, ó tò ó ní ẹsẹẹsẹ. Lábẹ́ ìlànà tuntun yìí ni ìjọba yóò ti máa gba 45,250 kwanzas fún ìwé ìwọ̀lú ìdúró-sí-ìlú; 21,350 fún ìwé ìwọ̀lú ìrìnàjò-afẹ́; 36,500 fún ìwé ìwọ̀lú àgbàníbodè; 38,125 fún ìsúnsíwájú ìwé ìwọ̀lú iṣẹ́; 15,250 fún ìwé ìwọ̀lú ọ̀rọ̀ ìlera ara; àti 30,500 fún ìwé pélébé ìgbélùú.
Agbẹnusọ fún Ẹ̀ka Ìjọba tí ó ń ṣe àbójútó ètò ìforúkọsílẹ̀, Valdemar José, sọ fún àwọn akọ̀ròyìn ìbílẹ̀ Angola pé ìdíyelé fún ìwé ìrìnnà ìwọ̀lú lásán-làsàn lọ sí òkè nítorí owó gegere ni ó ń jẹ láti ṣe ìwé náà:
(…) O governo ajustou o valor real do passaporte e deixou de subvencioná-lo, dando, por exemplo, prioridade à questão da água, luz e dos produtos de primeira necessidade. As cédulas para a emissão dos passaportes têm um custo elevado, por causa dos elementos de segurança usados nos documentos e, que até então o Estado subvencionava os custos do mesmo.
(…) Ìjọba rí i wípé ó tó àsìkò láti sún owó ìwé ẹ̀rí ọmọ-ìlú-fún-ìrìnnà, ó sì ti yọ ọwọ́ọ Kílàńkóo rẹ̀ kúrò nínú kíkó  owó lé e lórí, kí ó ba lè ṣe, fún àpẹẹrẹ, pèsè omi, ináa mànàmáná àti àwọn ohun amáyérọrùn mìíràn. Ohun èlò fún ìwé ẹ̀rí ọmọ-ìlú-fún-ìrìnnà máa ń gbọ́n owó mì, nítorí iṣẹ́ ìdáàbòbò oríi rẹ̀, tí àjọ ọba ń kówó lé lórí tẹ́lẹ̀ kí ó tó di ìgbà yìí.
Èyí jẹ́ ìrántí ohun tí ojú àwọn ọmọ Mozambique rí ní ìparí ọdún-un 2018, nígbàtí ìjọba pinnu láti fi owó kún ìwé àṣẹ gbogbo, bẹ́ẹ̀ náà ni ó bá ìwé àṣẹ ọkọ̀ wíwà, tí ìdíyelée rẹ̀ fi ìdá 500 gbéwó lórí.
Àfilé iye owó náà ti dá awuyewuye sílẹ̀. Ìfẹ̀hónúhàn ọ̀dọ̀ tí ó tó bíi 100 wáyé ní ọjọ́ kẹ́rin oṣù Èrèlé, pẹ̀lú àtìlẹ́yìn ẹgbẹ́ àwọn ọmọ ìlú kan tí ó rí ìgbésẹ̀ ìjọba gẹ́gẹ́ bí ọ̀nà láti gbẹ́sẹ̀ lé ẹ̀tọ́ àwọn ènìyàn fún ìrìnàjò ṣíṣe.
Ìfẹ̀hónúhàn náà 
Ìfẹ̀hónúhàn ní Luanda (ọjọ́ kẹrin oṣù Èrèlé). Àwòrán láti ọwọ́ọ  Simão Rossi, a lò ó pẹ̀lú àṣẹ.
Ní ọjọ́ kẹrin oṣù Èrèlé, Global Voices bá Fernando Gomes, ajìjàǹgbara ọmọ orílẹ̀ èdè Angola tí ó jẹ́ ọ̀kan lára àwọn alátìlẹ́yìn ìfẹ̀hónúhàn náà tàkùrọ̀sọ, láti mọ ohun gbogbo tí ó rọ̀ mọ́ ìṣẹ̀lẹ̀ náà. Ó sọ fún wa:
Essa forma encontrada para apelar a sensibilidade do executivo de João Lourenço, que esta não é a melhor fase para o aumento do preço, pois os cidadãos perderam o poder de compra de forma exponencial. (…) E que a tão aludida diversificação da economia angolana não pode passar exclusivamente pela elevação dos impostos direitos, visto que estes incidem apenas aos cidadãos, a classe política têm vários privilégios, que são custeados pelo cidadão de si já empobrecido”.
Èyí [ni ọ̀nà kan] fún ìpèsí àkíyèsí ìjọba João Lourenço, wípé àfilé ìdíyelé kò yẹ nírú àsìkò yìí, nítorí owó náà ti ṣe gegere ju fún àwọn ọmọ ìlú. (…) Àti pé “iṣẹ́ ìdàgbàsókè ọrọ̀ Ajé orílẹ̀-èdè Angola” kò lé wáyé nípasẹ̀ àfilé owó orí, nítorí wípé àwọn ọmọ ìlú ni ó ń fi orí kó o, àwọn tí ó wà ní ipò ìjọba ní àǹfààní tí ó pọ̀ ní ìkáwọ́ọ wọn, tí ó ṣe pé àpò ará ìlú tí ó ń rùnpà ni wọ́n ti ń mú owó tí wọ́n ń ná.
Àwọn alátakò ti sọ pé ó ṣe pàtàkì láti rántí wípé ìwé ẹ̀rí ọmọ-ìlú-fún-ìrìnnà dúró fún ìdánimọ̀ ọmọ ìlú ní òkè òkun, torí ìdí èyí, kò ṣe é yẹ̀ sílẹ̀ fún wọn.
Vamos ficar todo mês de Fevereiro nas ruas da cidade capital, de forma intercalada, dia 4 de Fevereiro foi o arranque das manifestações, mas dia 7 voltaremos às ruas, e novamente estaremos no dia 11 e dia 13 faremos uma reunião de balanço, caso não haja recuo do executivo na aplicação do decreto presidencial.
A máa wà ní ojú òpópónà ní olú ìlú fún oṣù Èrèlé, ní àwọn ọjọ́ kọ̀ọ̀kan tí a yàn, ọjọ́ kẹrin oṣù Èrèlé ni ìwọ́de náà bẹ̀rẹ̀, àmọ́ ní ọjọ́ kéje ni a máa padà sí ojú òpópónà, tí a óò tún wà ní ọjọ́ kankànlá, tí a ó sì jábọ̀ ní ọjọ́ kẹtàlá, bí ìjọba kò bá yí ohùn padà.
Àwọn akọrin ewì-alohùn ráàpù, Lilo Kwanza àti Adérito Gonçalves, kọ orin kan, tí wọ́n sì ya àwòrán-an orin tí ó dá lóríi ìwọ́de ìfẹ̀hónúhàn yìí, “Ìwé ẹ̀rí ọmọ-ìlú-fún-ìrìnnà 30,000″ ni àkọlé orin náà, tí ó ń ṣe ẹ̀fẹ̀ lórí iye owó tabua tí ọmọ-ìlú yóò san fún ìwé ìrìnnà.
Ó ku ọjọ́ díẹ̀ kí ìwọ́de náà ó kò, ajàfúnẹ̀tọ́ ọmọ orílẹ̀-èdè Angola Pedrowski Teca sọ wípé ìwé ẹ̀rí ọmọ-ìlú-fún-ìrìnná pọn dandan ju ìwé ìdánimọ̀ pélébé lọ, ó rọ àwọn ènìyàn láti kọ́wọ̀ọ́ rìn, nítorí àìkọ́wọ̀ọ́ rìn, ní í ṣe ikú pa ọmọ ejò:
Manifestação Internacional contra a subida absurda do preço dos Actos Migratórios.
OBS: O Bilhete de Identidade (B.I) só identifica o angolano dentro do território nacional. Fora de Angola, o B.I é inútil, pois o único documento de identificação válido é o passaporte.
Nós, dentro do país, vamos protestar e incentivamos os nossos compatriotas na diáspora a seguirem o mesmo caminho, pois o passaporte é mais útil para eles.
Àwọn àjọ àgbáyé ti dẹ̀yìn kọ Òfin Ìṣíkúrò tí ó pàṣẹ àfilé ìdíyelé tí ó gbéra nílẹ̀ fìrì tí ó sì lọ òkè lálá.
OBS: Ìwé ìdánimọ̀ pélébé (B.I) wúlò gẹ́gẹ́ bí àmì ìdánimọ̀ ní àárín ìlú Angola. Ní ẹ̀yìn odi ìlú Angola, pánda   tí kò wúlò ni ìwé ìdánimọ̀ pélébé, kò sí àmì ìdánimọ̀ kan tí ó wà bí kò ṣe ìwé ẹ̀rí ọmọ-ìlú-fún-ìrìnnà.
Àwa, tí a wà nínú ìlú, ni a ó fi ààbò bò tí a ó sì ké pe àwọn aráa wa ní òkè òkun, kí àwọn náà ó ké gbàjarè, nítorí ìwé ẹ̀rí ọmọ-ìlú-fún-ìrìnnà ṣe kókó fún wọn.
Kí ìròyìn náà ó ba hó ye létí àwọn ènìyàn, ajàfúnẹ̀tọ́ọ nì àti akẹ́kọ̀ọ́ Ifáfitì, David Mendes, kọ, ní ọjọ́ ìwọ́de náà, iṣẹ́-ìjẹ́ fún ààre orílẹ̀-èdè Angola João Lourenço:
Camarada presidente João Lourenço não foi pra isso que o povo angolano votou para o senhor em momento algum nas suas campanhas o senhor falou sobre a mudança de preços acerca dos documentos afinal de contas o quê que o senhor está pensar?
Onde é que fica a voz do povo? Já temos uma vida miserável com estás subidas de preçário o senhor tem noção da dificuldade que estás a criar neste povo? Sinceramente já não sabemos quem é o homem certo para governar a nossa Angola como é que fica o jovem que não tem um emprego de onde ele vai tirar o dinheiro para tratar os documentos?
Ọmọ-ẹgbẹ́ ààrẹ João Lourenço, kì í ṣe nítorí èyí ni àwọn aráa Angola ṣe yàn ọ́ sípò, kò sí ibi tí o ti sọ nínú ìpolongo ìléríi rẹ, o kò sọ pé ìwé ẹ̀rí yóò gbówó lórí, síbẹ̀ kí ni ò ń rò?
Kí ni ẹ fi ṣe ohùn àwọn mẹ̀kúnnù? A ti rí ìrora látàrí àwọn àfilé ìdíyelé, ǹjẹ́ o mọ ìṣòro tí ó ń fà fún àwọn ará ìlú? A kò tilẹ̀ mọ ẹni náà tí ó tọ́ láti tukọ̀ orílẹ̀-èdè Angola, báwo ni ọ̀dọ́ tí kò níṣẹ́ tí kò lábọ̀ yóò ṣe rí owó gba ìwé ẹ̀rí?
Pẹ̀lú gbogbo rẹ̀, ìjọba kò ì tíì sọ tó, tàbí kí ó kéde láti sọ bóyá òun yóò mú ìdíyelé náà wálẹ̀.",https://yo.globalvoices.org/2019/03/01/293/,1 Ẹrẹ́nà  2019
Jẹ́ kí àwọn òkú ó sọ ìtàn nípa Hong Kong,"Òpópónà Ilé-ìsìn òrìṣà, Yau Ma Tei, Hong Kong. ÀWÒRÁN: David Yan (CC BY 2.0)
Ìkìlọ̀: ìròyìn yìí ní àwọn àwòrán tí ó ń ṣe àfihàn ikú àti  ipá. Medium ti ṣe àtẹ̀jáde ẹ̀dàa ìròyìn yìí ṣáájú èyí.
Bí o bá ti rìnrìn àjò lọ sí Hong Kong, o ṣe é ṣe kí o dé Yau Ma Tei, agbègbè ọjà alẹ́ tí ó jẹ́ ìlúmọ̀nánká níbi tí àwọn ènìyàn ti máa ń lọ ra ọjà àti oúnjẹ ẹ̀gbẹ́ẹ títì. Yau Ma Tei jẹ́ ọ̀kan lára àwọn agbègbè tí èró pọ̀ sí jù lọ ní Hong Kong.
Láti ọdún-un 2016, ẹ̀ka- ìlú náà ti di ibùdó fún  “20,000 ọ̀nà láti gbà kú ní Yau Ma Tei”, ìtọ́nà “ìrìnàjò afẹ́ ìpànìyàn” tí Melody Chan àti èmitìkarami ṣe olùdásílẹ̀, tí ó ti ń gbé àdúgbò náà fún ọdún púpọ̀. Nípasẹ̀ ìrìnàjò afẹ́ náà, a fẹ́ mọ bí ayé àti ìgbé ayé ṣe rí ní Hong Kong.
Ìrìnàjò afẹ́ ojúnà oní kìlómítà 1.5 náà lọ láti arẹwà àti gúúsù Yau Ma Tei, àti ìrìnàjò dé ibi tí a ti pa ènìyàn 12 ní àárín-in wákàtí méjì. A bẹ̀rẹ̀ ẹ rẹ̀ gẹ́gẹ́ bíi ètò Halowíìnì láti kó owó jọ fún ilé-iṣẹ́ ìbílẹ̀ kan. Èsì tí a gbà dára tó bẹ́ẹ̀ ni ó mú wa tẹ̀síwájú nínú ìrìnàjò alẹ́ nínú oṣù  tí yìnyín bá ń bọ́ tí ojú ọjọ́ bá tútù. Oníṣẹ́ ìlú ni àwọn amọ̀nà, olùkọ́, oníṣègùn àti àwọn onímọ̀ mìíràn. Bí a bá kà á ní ẹníméjì, ó ti tó ènìyàn 500 tí ó ti ṣe ìrìnàjò náà.
Àwọn ọ̀ràn ìpànìyàn tí a yàn wáyé ní àárín-in ọdún-un 2012 to 2016. Nínú ìwé ìròyìn ni a ti ṣa àwọn ìròyìn àti àkọsílẹ̀ láti ọwọ́ọ ilé ẹjọ́ Oníwàádìí-ẹni-tí-ó-kú.
Ní ìsàlẹ̀ ni àwòrán-eré ránpẹ́ ìrìnàjò afẹ́ ọdún-un 2017 ní oríi YouTube:

Ó súnmọ́, síbẹ̀ ó jìnà 
Iye ènìyàn tí ó ń gbé ní ilẹ̀-tí-omí-fẹ́rẹ̀ẹ́-yíká Kowloon tó bíi èèyàn 40,000 ní orí ìwọ̀n kìlómítà kọ̀ọ̀kan, àti bí i ènìyàn 20,000 ni ó ń gbé Yau Ma Tei. Ọ̀pọ̀lọpọ̀ ńláǹlà ni a pín sí kéékèèké. Àwọn ènìyàn ń gbé súnmọ́ ara wọn, àmọ́ síbẹ̀, wọ́n jìnà sí ara wọn.
Àìmọye àwọn ènìyàn tí ó wà nínú ìrìnàjò afẹ́ náà jẹ́ àgbàlagbà. Bàbá arúgbó kan pa ara rẹ̀  nígbà tí ó bẹ́ láti ojúu fèrèsé ilé alájà-mẹ́rin pẹ̀lú okùn tí ó so mọ́ ọrùn.
Òkúu rẹ̀ ń fì ní ìta ògiri ilé náà ní títì ní àárín alẹ́, àmọ́ kò sí ẹni tí ó se àkíyèsí àfi ní ìgbà tí ó di fẹ̀ẹ̀rẹ̀ nígbà tí àwọn alùgbé ilé òdì kejì ṣí fèrèsée wọn.
Òmíràn ní í ṣe pẹ̀lú àwọn àgbàlagbà méjì tí a bá òkúu wọn nínú ilé, ọ̀kan kú ikú ebi. Àsẹ̀yìnwá ni ó tó yé wípé ọkọ náà ni ó ṣe olùtọ́jú aya, ẹni tí ó arán ń ṣe. Ọkọ náà kọsẹ̀ nínú yàrá ìgbàlejò, ó sì kú, ebí sì ṣe wẹ́rẹ́ pa ìyàwó sí orí ibùsùn. Ó jẹ́ ohun ìbànújẹ́ wípé kò sí ẹni tí ó fura sí irú ìgbé ayé ìjìyà àwọn àgbàlagbà méjì.
Gẹ́gẹ́ bí ètò ìkànìyàn ọdún-un 2016, mílíọ̀nù èèyàn 1.16 million ni ọmọ ọdún 65 àti jù bẹ́ẹ̀ lọ ní Hong Kong— ìyẹn 15.9 ìdá gbogbo ènìyàn. Ẹgbẹ̀rún 150 àwọn ènìyàn wọ̀nyí ni ó ń dá gbé. HK$5,780 (US$720) ni owó oṣù àwọn àgbàlagbà tí í ṣe òṣìṣẹ́-fẹ̀yìntì ní ọdún-un 2016 — àti owó ìrànwọ́ ìjọba lápapọ̀. Lọ́wọ́lọ́wọ́ báyìí, owó oṣù tí ó kéré jù lọ nínú tó HK$16,800 (US$2,200) dollars.
Àmọ́ gbígbé pẹ̀lú ẹbí tàbí ọ̀rẹ́ kò kan ti ìtìlẹyìn. Ìjàmbá oríṣi ni ó máa ń ṣẹlẹ̀ nínú ẹbí ní ìlú, pàápàá jù lọ ní àárín àwọn tí ó ń ṣiṣẹ́.
Ìṣẹ̀lẹ̀ kan wáyé, ọmọdébìnrin ọmọ ọdún 15 ni olóògbé tí ó máa ń múra bí ẹ̀dá-inú ìtàn tí a mọ̀ sí cosplay. Ó f'akọyọ nínú ẹ̀kọ́ọ rẹ̀ àmọ́ ó bá ẹbíi rẹ̀ ní gbólóhùn asọ̀ nítorí olólùfẹ́ẹ rẹ̀. Àbálọ àbábọ̀, ó kúrò ní ilé-ìwé, ó sì di ẹni-àpẹẹrẹ àwòrán láti so ẹ̀mí àti ara ró. Ẹni tí ó ṣiṣẹ́ fún tí ó san owó ọ̀yà HK$500 dollars (US$65) fún un ni ó pa a.
Òmíràn jẹ́ òkú ọmọ-ọwọ́ kan tí ìwọ́ọ rẹ̀ ṣì wà ní a ara rẹ̀, tí obìrin kan tí ó ń ṣe ìmọ́tótó ìbùdókọ̀ abẹ́-ilẹ̀ ní Yau Ma Tei bá nínú àpò kan. Lẹ́yìn ìwádìí, àwọn ọlọ́pàá ṣe àrídájú wípé ọmọ-ọ̀dọ̀ kan láti ilẹ̀ òkèèrè tí ó ń bẹ̀rù wípé ọ̀gá òun yóò lé òun ni ẹnu iṣẹ́ bí ó bá mọ̀ wípé òun ní oyún ni ìyáa rẹ̀. Obìrin náà jẹ èrè iṣẹ́ ọwọ́ọ rẹ̀ ní ẹ̀wọ̀n.
Ní abala ìrìnàjò afẹ́ yìí, amọ̀nà ṣe ìbéèrè: ṣé àwọn ọ̀gá obìnrin náà kò jẹ̀bi bí? Kò sí bí ó ṣe lè ṣẹlẹ̀ kí wọn ó máà mọ̀ wípé ẹni tí ó ń ṣiṣẹ́ fún wọn ní ojúmọ́ ní oyún ní inú. Ọmọ-ọ̀dọ̀ tí ó wà ní Hong Kong ju 370,000 lọ, òfin ṣì fi àyè gbà wọ́n kí ó máa gbé nínú ilé ọ̀gáa wọn.
Èyí ni àyè fi sílẹ̀ láti lè rí wọn bá sùn bí wọn bá ń ṣiṣẹ́ fún wákàtí púpọ̀, láì jẹun tí ó ṣe ara ní oore, àti bẹ́ẹ̀ bẹ́ẹ̀ lọ.
Lẹ́yìn ọdún kan tí ìṣẹ̀lẹ̀ yẹn wáyé, ọmọ-ọ̀dọ̀ ilẹ̀-òkèèrè mìíràn gba ìdádúró ní ẹnu iṣẹ́ fún oyún tí ó ní. Ó gba obìnrin náà ní ọdún méjì gbáko nílé ẹjọ́ láti jà fún ìdádúró láì bá òfin mu ní ẹnu iṣẹ́.
Ìpànìyàn ní àárín àwọn ènìyàn 
Ọ̀gọ̀rọ̀ ìpànìyàn ní Yau Ma Tei jẹ́ ẹsẹ̀ tí ó ti ọwọ́ àwọn ènìyàn fún ra wọn wá, tí ó jẹ́ ẹsẹ̀ tí wọn kò gbèrò tàbí pa ète rẹ̀ tẹ́lẹ̀, tí àwọn tí ó dá ẹ̀ṣẹ̀ sì ṣe àṣìṣe.
Ó ní ìṣẹ̀lẹ̀ tí ọkùnrin kan pa ẹ̀gbọ́n-ọn rẹ̀ ọkùnrin ní ìta gbangba ní ojúu títì pẹ̀lú ọbẹ̀ ìwọ̀n ínṣì mẹ́sàn-án tí ó wọ inú ẹ̀dọ̀ fóró ẹ̀gbọ́n-ọn rẹ̀ lọ. Ẹ̀bùn ni ó yẹ kí ọbẹ̀ náà jẹ́ fún ẹ̀gbọ́n náà.
Apànìyàn kan takú sí ibi ìpànìyàn lẹ́yìn tí ó pa ènìyàn tán; òmíràn fi ìwé pẹlẹbẹ ìdánimọ̀ọ rẹ̀ gba iyàrá tí ó tọ́jú òkú ẹni tí ó pa sí.
Ìpànìyàn mìíràn wáyé ní ilé ìtaja-ohun-èlò-inú-ilé. Ẹ̀rọ-ayàwòrán amóhùnmáwòrán ká ìṣẹ̀lẹ̀ náà sílẹ̀. Onírìn àjò ìgbafẹ́ tí ó ń lo ìwé-ìrìnnà Orílẹ̀-èdè Canada ni apànìyàn náà, ẹni tí ó gún òǹtajà ìsọ̀ náà nígbà tí òǹtajà bíi léèrè ìdí tí ó fi kó ọjà láì san owó.
Àlábàápàdé àwọn ẹ̀mí àti òjìjíi wọn 
Ọ̀pọ̀ àwọn arìnrìn-àjò afẹ́ jẹ́ akẹ́kọ̀ọ́ ilé-ẹ̀kọ́ gíga. Àwọn kan kópa nítorí wọ́n fẹ́ rí àrídájú; àwọn mìíràn rí i bí ọ̀nà láti fi ìmọ̀ kún ìmọ̀. Oníṣègùn kan tí í ṣe ikọ̀ òṣìṣẹ́ ìlera tí ó ṣe ìrìnàjò náà sọ wípé:
The protagonist of the case is very similar to the patients we often encounter in the accident and emergency wards – drug addicts, street sleepers, refugees. We all have to rescue them in the emergency room. But usually they are quite hostile in their attitudes. It’s very difficult to deal with them and we tend to lose patience over time.
This guided tours remind us that we must be patient and should not become indifferent. And their lives are very miserable and they struggle hard to survive.
Ẹni ọ̀ràn yìí dà bíi àwọn aláàárẹ̀ tí a máa ń bá pàdé nínú ìyára ìtọ́jú àwọn tí ó ní ìjàmbá àti ìtọ́júu pàjàwìrì – àwọn tí egbògi olóró tí sọ di ìdàkudà, àwọn tí ó ń sun títì, àwọn ogún-lé-mi-dé. Iṣẹ́ẹ gbogbo wa ni láti dóòlà ẹ̀míi wọn ní yàráa pàjàwìrì. Àmọ́ wọ́n máa ń kanra nígbà mìíràn. Kì í rọrùn bí a bá ń ṣe ìtọ́júu wọn, nítorí náà a máa sọ sùúrù nù.
Ìrìnàjò afẹ́ yìí rán wa létí wípé a nílòo sùúrù bí a bá ń dá àwọn aláàárẹ̀ lóhùn. Àti pé ayé ìrora ni wọ́n ń gbé, wọ́n sì ń tiraka láti gbé.
Onírúurú ikú ni yóò pa gbogbo àwọn olùgbée 20,000 Yau Ma Tei. Ìgbàgbọ́ọ wa ni wípé bí ikú bá kanlẹ̀kùn, ẹ̀míi wọn yóò máa ráre kiri ní àárín-in àdúgbò àti ní òpópónà, láti máa rán àwọn ènìyàn létí nípa ìtúmọ̀ ìwà láyé. Ìrìnàjò yìí ń lépa láti pèsè àyè fún àwọn òjìjí láti sọ ìtàn ara wọn.
Ohun tí ó ń fa ikú ni ìbàjẹ́ ọkàn tí a ò wò sàn. Ìbàjẹ́ ọkàn ní ìwòsàn, a sì lè dènà ìpànìyàn. Ó lè rí ìrànwọ́ fún àwọn tí ó ń bá ìparaẹni fà á àti àwọn tí ó wà nínú ìbàjẹ́ ọkàn. Lọ sí Befrienders.org fún ojú òpó ìbánisọ̀rọ̀ ìdènà ìparaẹni ní orílẹ̀-èdèe rẹ.",https://yo.globalvoices.org/2019/02/14/242/,14 Èrèlé  2019
